thread_id,prolific_id,qualtrics_id,condition,thread_created_at,item_id,role,message,message_created_at
cthr_69b4de3de02c8190bffc019a0e8fcfaa03e1c9a3cb8c415a,,,,2026-03-14T04:04:13,cti_69b4de42c1e4819092fcf2956083317703e1c9a3cb8c415a,assistant,"How can I help you with your honesty statement?

I can refine your draft or draft a concise version under 40 words. Here are two starting options (each under 40 words):
- I will report the true number of heads observed in my 10 flips, regardless of payment.
- I will not misreport or fabricate my total heads; I will be honest in all responses.",2026-03-14T04:04:19
cthr_69b4de3de02c8190bffc019a0e8fcfaa03e1c9a3cb8c415a,,,,2026-03-14T04:04:13,cti_69b4de49b1e88190a018d47a71a6610803e1c9a3cb8c415a,user,not much,2026-03-14T04:04:25
cthr_69b4de3de02c8190bffc019a0e8fcfaa03e1c9a3cb8c415a,,,,2026-03-14T04:04:13,cti_69b4de4e136c8190a84411badffdf6df03e1c9a3cb8c415a,assistant,"How can I help you with your honesty statement? Here are two concise options under 40 words:

- I will report the exact number of heads observed in my 10 flips, with no fabrication or withholding.
- I will report only the true total of heads from my 10 flips, without misrepresentation.",2026-03-14T04:04:30
cthr_69b4dc98fc4c819583672b2ebe16e73509a39b92494d1458,,,,2026-03-14T03:57:12,cti_69b4dc9909ec81958c60c39f80db247009a39b92494d1458,user,stmnt1,2026-03-14T03:57:13
cthr_69b4dc98fc4c819583672b2ebe16e73509a39b92494d1458,,,,2026-03-14T03:57:12,cti_69b4dc9f872c8195bdcb5301bd1d3ab509a39b92494d1458,assistant,"How can I help with your honesty statement?

I will report all results honestly.",2026-03-14T03:57:19
cthr_69b4d525f47881949bca8b70644cd035015ea71817662444,,,,2026-03-14T03:25:25,cti_69b4d526039481949c4e50a7ec4c2e06015ea71817662444,user,oh thank god!,2026-03-14T03:25:26
cthr_69b4d525f47881949bca8b70644cd035015ea71817662444,,,,2026-03-14T03:25:25,cti_69b4d5297b648194a7f0792f159dc0e9015ea71817662444,assistant,"How can I help with your honesty statement? If you have a draft, I’ll refine it. If you’d like a starting line, I can provide a couple of options (each under 40 words). 

Two starter phrases:
- I pledge to report my results honestly, regardless of incentives.
- I will not misrepresent the number of heads I observed.",2026-03-14T03:25:29
cthr_69b4d525f47881949bca8b70644cd035015ea71817662444,,,,2026-03-14T03:25:25,cti_69b4d53701fc8194a1396432aec2205b015ea71817662444,user,yes i fdo not want to midrepresent,2026-03-14T03:25:43
cthr_69b4d525f47881949bca8b70644cd035015ea71817662444,,,,2026-03-14T03:25:25,cti_69b4d53b98948194a83dc8dd0dba8e7c015ea71817662444,assistant,"How can I help with your honesty statement? If you have a draft, I’ll refine it. If you’d like a starting fragment, here are a few words to begin: I promise to report honestly.",2026-03-14T03:25:47
cthr_69b48386d6d08194b6c75472ff40796c06373d7701acf30e,,,,2026-03-13T21:37:10,cti_69b48386e37481949ac2f87f9e58bc4806373d7701acf30e,user,test how are we doing. I really want to e honest,2026-03-13T21:37:10
cthr_69b48386d6d08194b6c75472ff40796c06373d7701acf30e,,,,2026-03-13T21:37:10,cti_69b4838d35948194b98e7956a72c7f0306373d7701acf30e,assistant,"How can I help refine your honesty statement?

I can review your draft, or help start it. Here are two starter options:
- I will report my results truthfully.
- I promise to state my heads honestly and completely.",2026-03-13T21:37:17
cthr_69b48386d6d08194b6c75472ff40796c06373d7701acf30e,,,,2026-03-13T21:37:10,cti_69b483b16e488194be022f06ea87650906373d7701acf30e,user,okie dokie! i will trust,2026-03-13T21:37:53
cthr_69b48386d6d08194b6c75472ff40796c06373d7701acf30e,,,,2026-03-13T21:37:10,cti_69b483b655b88194a75cf19f9cfd7cde06373d7701acf30e,assistant,"How can I help refine your honesty statement? If you want a quick start, try: I will report my results truthfully and to the best of my ability.",2026-03-13T21:37:58
cthr_69b0e42494f48195bb1b3aabe6f502120ef1ccf1d20ab103,abc,test123,A,2026-03-11T03:40:20,cti_69b0e424a4208195a019329be82b372f0ef1ccf1d20ab103,user,I am testing normally on local,2026-03-11T03:40:20
cthr_69b0e42494f48195bb1b3aabe6f502120ef1ccf1d20ab103,abc,test123,A,2026-03-11T03:40:20,cti_69b0e4369db081959f55e212c848194d0ef1ccf1d20ab103,assistant,"How can I help with your honesty statement? I can refine your current draft or compose a new one under 40 words.

If you want a starting fragment, here are two options:
- I will report my counts truthfully
- I commit to recording every flip honestly",2026-03-11T03:40:39
cthr_69b0e42494f48195bb1b3aabe6f502120ef1ccf1d20ab103,abc,test123,A,2026-03-11T03:40:20,cti_69b0e43bf19c8195a6fafab2c97746f10ef1ccf1d20ab103,user,I am ok.,2026-03-11T03:40:43
cthr_69b0e42494f48195bb1b3aabe6f502120ef1ccf1d20ab103,abc,test123,A,2026-03-11T03:40:20,cti_69b0e44a6618819596ec6a7e77583cd90ef1ccf1d20ab103,assistant,"Great. Want me to refine your current honesty statement or draft a new one (≤40 words)? Here are two starters:
1) I will report my counts truthfully.
2) I commit to recording every flip honestly.",2026-03-11T03:40:59
cthr_69b0e3d490048197965f3ef897a6eccb08bf0addb5c07ab4,abc,test123,A,2026-03-11T03:39:00,cti_69b0e3d49e288197982b783f5c18a36c08bf0addb5c07ab4,user,hello,2026-03-11T03:39:00
cthr_69b0e3d490048197965f3ef897a6eccb08bf0addb5c07ab4,abc,test123,A,2026-03-11T03:39:00,cti_69b0e3da4ed8819793c7ddbb19eba1b708bf0addb5c07ab4,assistant,How can I help you with your honesty statement? I can refine your draft or compose a concise version for this coin-flip task and ethics. Want me to start with a brief opener?,2026-03-11T03:39:06
cthr_69b0d64690ac819585cdad938695cc4308a7bb7e6612ae86,haritima10,R_10ufXVsuAXAst2P,,2026-03-11T02:41:10,cti_69b0d6469dc88195b7238a0a548da23508a7bb7e6612ae86,user,i need chocolates,2026-03-11T02:41:10
cthr_69b0d64690ac819585cdad938695cc4308a7bb7e6612ae86,haritima10,R_10ufXVsuAXAst2P,,2026-03-11T02:41:10,cti_69b0d64e35588195a07ddbb87abe9cbd08a7bb7e6612ae86,assistant,"How can I help with your honesty statement?

Here are a couple of starting fragments you can finish:
- I pledge to report my total heads honestly.
- I will not misreport or shirk the flips, and I will follow the task.",2026-03-11T02:41:18
cthr_69b0d64690ac819585cdad938695cc4308a7bb7e6612ae86,haritima10,R_10ufXVsuAXAst2P,,2026-03-11T02:41:10,cti_69b0d660827c8195a8da3064265b66df08a7bb7e6612ae86,user,not much,2026-03-11T02:41:36
cthr_69b0d64690ac819585cdad938695cc4308a7bb7e6612ae86,haritima10,R_10ufXVsuAXAst2P,,2026-03-11T02:41:10,cti_69b0d66fc7808195806896093fb9f8d408a7bb7e6612ae86,assistant,"How can I help with your honesty statement?

I pledge to report truthfully.",2026-03-11T02:41:52
cthr_69b0ce93761081948a87a2bb86e5a4400af26ba71743c1d5,haritima10_2,R_1Dj6uG1KGkPFETw,,2026-03-11T02:08:19,cti_69b0ce93855c8194abaf069dd8f700e10af26ba71743c1d5,user,i am happy today,2026-03-11T02:08:19
cthr_69b0ce93761081948a87a2bb86e5a4400af26ba71743c1d5,haritima10_2,R_1Dj6uG1KGkPFETw,,2026-03-11T02:08:19,cti_69b0ce9ac764819499325a7b7905f2fc0af26ba71743c1d5,assistant,"How can I help with your honesty statement? If you have a draft, share it and I’ll refine it. I can also compose a short starter line (two options) for you.",2026-03-11T02:08:26
cthr_69b0ce93761081948a87a2bb86e5a4400af26ba71743c1d5,haritima10_2,R_1Dj6uG1KGkPFETw,,2026-03-11T02:08:19,cti_69b0cea5f41c81948bf55189cadbf2e80af26ba71743c1d5,user,help me in making a decision,2026-03-11T02:08:37
cthr_69b0ce93761081948a87a2bb86e5a4400af26ba71743c1d5,haritima10_2,R_1Dj6uG1KGkPFETw,,2026-03-11T02:08:19,cti_69b0ceaab25c81948bbd756f65b9a3a00af26ba71743c1d5,assistant,"How can I help with your honesty statement? If you’re deciding what to include, I can help clarify options or draft a starter line.

Starter fragments (just a few words to begin):
- I will report honestly
- I commit to accuracy

Tell me more about the decision you’re facing, and I’ll tailor guidance or refine your draft.",2026-03-11T02:08:43
cthr_69b0bec378c08197b73060282122515e0c5f24898e060b67,haritima10,R_1q4566nOuF9OkqT,,2026-03-11T01:00:51,cti_69b0bec3860c81978d53fa4475c515340c5f24898e060b67,user,not much today,2026-03-11T01:00:51
cthr_69b0bec378c08197b73060282122515e0c5f24898e060b67,haritima10,R_1q4566nOuF9OkqT,,2026-03-11T01:00:51,cti_69b0bec8e5888197ba20c881e3ae69690c5f24898e060b67,assistant,"How can I help you with your honesty statement today? Do you want to draft, edit, or brainstorm? I can start with a brief sentence or two if you’d like—here are two quick starters (under 40 words total):

- I will report my results honestly, regardless of rewards or penalties.
- I will not misreport or shirk, and I will disclose any uncertainty in my results.",2026-03-11T01:00:57
cthr_69b0af7a301481949ff8d02c779984cf0f4d0bd4845f9898,jobu10march,R_6My8tu2BbtQt1lx,,2026-03-10T23:55:38,cti_69b0af7a3d6481949980067403972ce60f4d0bd4845f9898,user,Help me finish this string: I promise to say thanks for Haritima...,2026-03-10T23:55:38
cthr_69b0af7a301481949ff8d02c779984cf0f4d0bd4845f9898,jobu10march,R_6My8tu2BbtQt1lx,,2026-03-10T23:55:38,cti_69b0af831f908194b5de1749959a66cc0f4d0bd4845f9898,assistant,"How can I help with your honesty statement?

Finish idea: I promise to say thanks for Haritima’s guidance and fairness.",2026-03-10T23:55:47
cthr_69b0ac9d8cec8196b8a4eb488859161e0872c17c1a6eabec,,,,2026-03-10T23:43:25,cti_69b0ac9d98dc81968fe8f54c751932b50872c17c1a6eabec,user,haritima texting right now.,2026-03-10T23:43:25
cthr_69b0ac9d8cec8196b8a4eb488859161e0872c17c1a6eabec,,,,2026-03-10T23:43:25,cti_69b0aca1a0288196a0344757e7e8f7890872c17c1a6eabec,assistant,"How can I help with your honesty statement? I can refine your draft or compose one for you. If you’d like a quick start, I can provide a few opening fragments. Share your current draft or tell me your goal.",2026-03-10T23:43:29
cthr_69b095ddc2e481979412b76af9f3db570d60486a457b1ab4,,,,2026-03-10T22:06:21,cti_69b095ddcfe88197b6d0e970fa7214030d60486a457b1ab4,user,on main app,2026-03-10T22:06:21
cthr_69b095ddc2e481979412b76af9f3db570d60486a457b1ab4,,,,2026-03-10T22:06:21,cti_69b095e3cd4081979828327b2879a3e80d60486a457b1ab4,assistant,"How can I help with your honesty statement? I can refine your draft or compose a new one. Share what you have, or tell me which angle you want to start from. I can also offer two brief example options if you’d like.",2026-03-10T22:06:28
cthr_69b0951ae36481958ce0de36900bfa86016ab6dec863f4f9,,,,2026-03-10T22:03:06,cti_69b0951af0708195a90a6ce45c6b5ac9016ab6dec863f4f9,user,new test,2026-03-10T22:03:06
cthr_69b0951ae36481958ce0de36900bfa86016ab6dec863f4f9,,,,2026-03-10T22:03:06,cti_69b0951fca3c8195890d04299823880a016ab6dec863f4f9,assistant,"How can I help with your honesty statement? I can refine an existing draft or help create a new one tailored to the coin-flip task. If you want a starter, here are two options:

- I will report
- I commit to

Tell me your preferences and I’ll refine further.",2026-03-10T22:03:12
cthr_69b0913368f481949c44227a5e36da460cdcb0c72fd21dcd,,,,2026-03-10T21:46:27,cti_69b0913376508194b3e7ab8105e7d5c20cdcb0c72fd21dcd,user,checking!,2026-03-10T21:46:27
cthr_69b0913368f481949c44227a5e36da460cdcb0c72fd21dcd,,,,2026-03-10T21:46:27,cti_69b09137bbf08194ada88cac6c73bfbe0cdcb0c72fd21dcd,assistant,How can I help with your honesty statement? Do you want me to refine an existing draft or compose a new one? I can also provide two starter options if you’d like.,2026-03-10T21:46:32
cthr_69a08b497d8c8193b468744212078aee0b39d52293518da1,${q://QID1/ChoiceTextEntryValue},${e://Field/UID},,2026-02-26T18:04:57,cti_69a08b4998b88193b0ec82766eadbbc90b39d52293518da1,user,Just write the honest statement for me.,2026-02-26T18:04:57
cthr_69a08b497d8c8193b468744212078aee0b39d52293518da1,${q://QID1/ChoiceTextEntryValue},${e://Field/UID},,2026-02-26T18:04:57,cti_69a08b53eaa481938fce58a17e6feb380b39d52293518da1,assistant,"How can I help with your honesty statement?
I will report my true number of heads from the 10 flips, and will not misreport or shirk. I understand accuracy matters for fairness and ethics in this study.",2026-02-26T18:05:09
cthr_69a08aa3d404819093ade0c086563c310fdd65b2008653be,${q://QID1/ChoiceTextEntryValue},${e://Field/UID},,2026-02-26T18:02:11,cti_69a08aa3daf081909ad6914501af95ab0fdd65b2008653be,user,I need to be honest about how many times i flipped the coin ( refine it),2026-02-26T18:02:11
cthr_69a08aa3d404819093ade0c086563c310fdd65b2008653be,${q://QID1/ChoiceTextEntryValue},${e://Field/UID},,2026-02-26T18:02:11,cti_69a08aaa9a108190b135c1f832acaeb00fdd65b2008653be,assistant,"How can I help refine your honesty statement?

Here are two concise options (under 40 words each):

Option A: I truthfully report the exact number of heads observed in my 10 flips, and I did flip the coin as instructed. I will not misreport results.

Option B: I accurately report the total heads from my 10 flips, having performed each flip. I will not inflate or withhold results.",2026-02-26T18:02:19
cthr_6997398d288c8190994e4701e8f573bf0e5636e371e75584,${q://QID1/ChoiceTextEntryValue},${e://Field/UID},,2026-02-19T16:25:49,cti_6997398d2f20819090fa0282f9640ef30e5636e371e75584,user,Tell me about the task and peoples incentives in it,2026-02-19T16:25:49
cthr_6997398d288c8190994e4701e8f573bf0e5636e371e75584,${q://QID1/ChoiceTextEntryValue},${e://Field/UID},,2026-02-19T16:25:49,cti_699739926f7081909438c9b903e3c3a00e5636e371e75584,assistant,"How can I help with your composition?

Brief task and incentives:
- Each person flips a coin 10 times unobserved.
- They self-report the total number of heads (0–10).
- Payment is $0.10 per reported head (zero if nothing is reported beyond that).
- Incentives exist to misreport (inflating or deflating) and risk of shirking (not flipping at all).
- The setup makes honest reporting ethically important; in a large sample, 5 heads out of 10 is a typical outcome.

If you’d like, I can help draft an honesty statement for this scenario (under 40 words). Would you like two example starters or a near-final oath?",2026-02-19T16:25:55
cthr_699250cb3be88196bdb43f1be0987f390900bb08d6f8dc5c,dfGWDGQWR,R_68ne692pUudCQyB,,2026-02-15T23:03:39,cti_699250cb47e88196aaaa93c5ae2f25210900bb08d6f8dc5c,user,Just write the honest statement for me.,2026-02-15T23:03:39
cthr_699250cb3be88196bdb43f1be0987f390900bb08d6f8dc5c,dfGWDGQWR,R_68ne692pUudCQyB,,2026-02-15T23:03:39,cti_699250d03bbc8196b31cd78e03f494c00900bb08d6f8dc5c,assistant,"I can help refine it. Here is a concise honesty statement:  
I will report my true number of heads from the 10 coin flips, honestly and to the best of my recollection, and I will not misreport to gain financial or other advantage.",2026-02-15T23:03:44
cthr_69924f63ee6881968bc01e6a0c15176d0dd55c4880878140,hvjghsfdgfjh,R_6PzyDePNPr1TQiJ,,2026-02-15T22:57:39,cti_69924f63fd0c8196a5e665980cf708750dd55c4880878140,user,Just write the honest statement for me.,2026-02-15T22:57:39
cthr_69924f63ee6881968bc01e6a0c15176d0dd55c4880878140,hvjghsfdgfjh,R_6PzyDePNPr1TQiJ,,2026-02-15T22:57:39,cti_69924f6b041081968357c092d5e364480dd55c4880878140,assistant,"How can I help with your composition today?

I will report exactly the number of heads I observed in my ten coin flips, truthfully and fully, and I will not misreport or shirk the task.",2026-02-15T22:57:47
cthr_69924bf21290819789cccae89793abad053718a40acc9b1f,dgsadgsdsga,R_7WN0dqlFTGJaSxX,,2026-02-15T22:42:58,cti_69924bf21f0481979994990b346c2a9c053718a40acc9b1f,user,"Edit my statement for clarity, tone, and structure.",2026-02-15T22:42:58
cthr_69924bf21290819789cccae89793abad053718a40acc9b1f,dgsadgsdsga,R_7WN0dqlFTGJaSxX,,2026-02-15T22:42:58,cti_69924bf46f348197b5173b28afd8f347053718a40acc9b1f,assistant,"How can I help refine your honesty statement? Please paste your current draft. I’ll edit for clarity, tone, and structure (keeping edits under 40 words). If you want, I can offer two example revisions after you share it.",2026-02-15T22:43:00
cthr_69924bf21290819789cccae89793abad053718a40acc9b1f,dgsadgsdsga,R_7WN0dqlFTGJaSxX,,2026-02-15T22:42:58,cti_69924c06a1408197b49a4efe811c965c053718a40acc9b1f,user,I promise not to lie or misreport my data. I will accurately report my 10 flips,2026-02-15T22:43:18
cthr_69924bf21290819789cccae89793abad053718a40acc9b1f,dgsadgsdsga,R_7WN0dqlFTGJaSxX,,2026-02-15T22:42:58,cti_69924c0b1ec48197957219d67d62d0d8053718a40acc9b1f,assistant,"How can I help refine your honesty statement? Here is a refined version, keeping it concise:

I will report my ten flips honestly and not lie or misreport my data.

Would you like two alternative options as well?",2026-02-15T22:43:23
cthr_69924bf21290819789cccae89793abad053718a40acc9b1f,dgsadgsdsga,R_7WN0dqlFTGJaSxX,,2026-02-15T22:42:58,cti_69924c172a4881979dc736c92b8fea13053718a40acc9b1f,user,make it nice and professional,2026-02-15T22:43:35
cthr_69924bf21290819789cccae89793abad053718a40acc9b1f,dgsadgsdsga,R_7WN0dqlFTGJaSxX,,2026-02-15T22:42:58,cti_69924c1c427c8197b07ef4dfbd0bf322053718a40acc9b1f,assistant,"How can I help refine your honesty statement? Here’s a professional version: I will report the results of my ten flips honestly and will not misreport any data.

Two alternatives:
- I will disclose my ten flip results truthfully and without misreporting.
- I will present my ten flip outcomes honestly and accurately.",2026-02-15T22:43:40
cthr_69924bf21290819789cccae89793abad053718a40acc9b1f,dgsadgsdsga,R_7WN0dqlFTGJaSxX,,2026-02-15T22:42:58,cti_69924c2a63188197883ff75ecc98ab36053718a40acc9b1f,user,yes,2026-02-15T22:43:54
cthr_69924bf21290819789cccae89793abad053718a40acc9b1f,dgsadgsdsga,R_7WN0dqlFTGJaSxX,,2026-02-15T22:42:58,cti_69924c2d085c8197a7a764679a88ffdf053718a40acc9b1f,assistant,"Here are two professional options:

- I will report the results of my ten flips truthfully and without fabricating data.
- I will disclose my ten flip outcomes honestly and accurately.",2026-02-15T22:43:57
cthr_69924bf21290819789cccae89793abad053718a40acc9b1f,dgsadgsdsga,R_7WN0dqlFTGJaSxX,,2026-02-15T22:42:58,cti_69924c393e2c8197867d565fa87e91db053718a40acc9b1f,user,minumum 20 words,2026-02-15T22:44:09
cthr_69924bf21290819789cccae89793abad053718a40acc9b1f,dgsadgsdsga,R_7WN0dqlFTGJaSxX,,2026-02-15T22:42:58,cti_69924c3cf8488197b918ebac799964fa053718a40acc9b1f,assistant,"Here is a professional option (26 words):

I will report the results of my ten coin flips truthfully and without fabrication, misreporting, or withholding data, and will ensure accuracy in all my disclosures.

Would you like a second option?",2026-02-15T22:44:13
cthr_69924b6725088194aa3fa2c54076331a0170de14f4082910,sdfagaswgw,R_1kjDY470uKLVjym,,2026-02-15T22:40:39,cti_69924b6731188194bb34906c7de7f4910170de14f4082910,user,Just write the honest statement for me.,2026-02-15T22:40:39
cthr_69924b6725088194aa3fa2c54076331a0170de14f4082910,sdfagaswgw,R_1kjDY470uKLVjym,,2026-02-15T22:40:39,cti_69924b6cefb08194b76112f419ff9cc80170de14f4082910,assistant,"How can I help you refine your composition? Here is a concise honest statement you can use:

I will report the exact number of heads I observe in 10 coin flips, truthfully and without misrepresenting results, recognizing that accurate reporting upholds fairness and the integrity of this study.",2026-02-15T22:40:45
cthr_69924a254f3c819391fae2e2a99f695e0678877331628956,dafes,R_52PwhZ1To4esLqQ,,2026-02-15T22:35:17,cti_69924a255b6c81938ef1290a5b3fd11b0678877331628956,user,Just write the honest statement for me.,2026-02-15T22:35:17
cthr_69924a254f3c819391fae2e2a99f695e0678877331628956,dafes,R_52PwhZ1To4esLqQ,,2026-02-15T22:35:17,cti_69924a3f0d908193a3f9a822a15c699f0678877331628956,assistant,"How can I help with your honesty statement? Here are two concise options you can use or adapt (each under 40 words):

1) I report the number of heads I actually observed in my ten coin flips, and I understand that misleading reporting undermines the study and my own integrity.

2) I will report honestly the total heads from my ten flips; I will not misstate results or shirk the task, recognizing honesty sustains fairness and the validity of the study.",2026-02-15T22:35:43
cthr_699249faba04819395d8884d164253190c7574546be93daa,dafes,R_52PwhZ1To4esLqQ,,2026-02-15T22:34:34,cti_699249fac8c881939b0b8e76736327c90c7574546be93daa,user,Help me finish and polish the ending of my statement.,2026-02-15T22:34:34
cthr_699249faba04819395d8884d164253190c7574546be93daa,dafes,R_52PwhZ1To4esLqQ,,2026-02-15T22:34:34,cti_699249ff742081939809d69824c3befb0c7574546be93daa,assistant,"How can I help you with your honesty statement? Please paste your current ending, and I’ll refine and tighten it. If you’d like, I can also offer two concise ending options (each under 40 words) after you share your draft.",2026-02-15T22:34:39
cthr_699249faba04819395d8884d164253190c7574546be93daa,dafes,R_52PwhZ1To4esLqQ,,2026-02-15T22:34:34,cti_69924a064fe481939af4627c877fb6190c7574546be93daa,user,I promise not to lie,2026-02-15T22:34:46
cthr_699249faba04819395d8884d164253190c7574546be93daa,dafes,R_52PwhZ1To4esLqQ,,2026-02-15T22:34:34,cti_69924a0bee84819383dc2d5f6c04c2f20c7574546be93daa,assistant,"How can I help you with your honesty statement? Here are two polished ending options (each under 40 words):

- I promise to report the true number of heads I observed, to the best of my ability, and to refrain from deception in this task.
- I promise to report honestly the number of heads, to the best of my ability, and to refrain from any misreporting.",2026-02-15T22:34:52
cthr_699249faba04819395d8884d164253190c7574546be93daa,dafes,R_52PwhZ1To4esLqQ,,2026-02-15T22:34:34,cti_69924a147770819388701b9c57595e120c7574546be93daa,user,just write it for me bro,2026-02-15T22:35:00
cthr_699249faba04819395d8884d164253190c7574546be93daa,dafes,R_52PwhZ1To4esLqQ,,2026-02-15T22:34:34,cti_69924a1be4e88193abdc5d92ce59683f0c7574546be93daa,assistant,"I can help refine your ending. Here are two polished options (each under 40 words):

- I promise to report the true number of heads I observed, to the best of my ability, and to refrain from deception in this task.
- I promise to report honestly the number of heads I observed, to the best of my ability, and to refrain from misreporting.",2026-02-15T22:35:09
cthr_69924621e8e08194a46c25c734159a04048fb0f5f9ba004a,dasfgfda,R_637JKPV1eZXufhn,,2026-02-15T22:18:09,cti_69924621f5dc8194a3ec9701b3477e89048fb0f5f9ba004a,user,Just write the honest statement for me.,2026-02-15T22:18:09
cthr_69924621e8e08194a46c25c734159a04048fb0f5f9ba004a,dasfgfda,R_637JKPV1eZXufhn,,2026-02-15T22:18:09,cti_69924629004081948ad48a30d52e6993048fb0f5f9ba004a,assistant,"How can I help with your honesty statement today?

I will truthfully report the number of heads I observed in my ten coin flips, without exaggeration or deceit, and I will not manipulate my results or the reporting for financial or personal gain.",2026-02-15T22:18:17
cthr_69924621e8e08194a46c25c734159a04048fb0f5f9ba004a,dasfgfda,R_637JKPV1eZXufhn,,2026-02-15T22:18:09,cti_6992462ea3b0819499f9405bb659fbef048fb0f5f9ba004a,user,more words,2026-02-15T22:18:22
cthr_69924621e8e08194a46c25c734159a04048fb0f5f9ba004a,dasfgfda,R_637JKPV1eZXufhn,,2026-02-15T22:18:09,cti_699246337cf48194bf91207db9844c16048fb0f5f9ba004a,assistant,"I will truthfully report the number of heads observed in my ten coin flips, neither concealing nor inflating results, and I will refrain from any falsification or manipulation for financial incentives or personal gain.",2026-02-15T22:18:27
cthr_698e36a7fe208190b03ad2c923cc5b650ea8295388ec32c2,poihgchx,R_7kYak02s4BRPQdt,,2026-02-12T20:23:03,cti_698e36a8086c81908e6a3c386052eb330ea8295388ec32c2,user,Just write the honest statement for me.,2026-02-12T20:23:04
cthr_698e36a7fe208190b03ad2c923cc5b650ea8295388ec32c2,poihgchx,R_7kYak02s4BRPQdt,,2026-02-12T20:23:03,cti_698e36aeb2d48190901eda0d52b7269b0ea8295388ec32c2,assistant,"How can I help with your composition? Here is an honest statement you can use (under 40 words):

I report my observed number of heads honestly, and I will not misreport or shirk; I understand misreporting undermines the study and may affect others.",2026-02-12T20:23:11
cthr_698d298a001081969bdab5d9a1c6ed280a07029663778f5b,strdytfyguh,R_6aauObMTtNgcMdK,,2026-02-12T01:14:49,cti_698d298a0cf88196a7633f17ef8f15330a07029663778f5b,user,"Make an honesty statement for me, minimum 20 words",2026-02-12T01:14:50
cthr_698d298a001081969bdab5d9a1c6ed280a07029663778f5b,strdytfyguh,R_6aauObMTtNgcMdK,,2026-02-12T01:14:49,cti_698d299030408196871a3be312147be80a07029663778f5b,assistant,"How can I help with your composition? Here is a drafted honesty statement you can use, under 40 words:

I will report my real number of heads honestly, acknowledge the possibility of misreporting, and refrain from deception or withholding effort, understanding that integrity sustains the fairness and reliability of this study.

Here’s a second option (22 words):

I will disclose my real heads, not exaggerate or dodge effort, and uphold honesty as essential to the study’s trust and fairness.",2026-02-12T01:14:57
cthr_6984cd9b01688193929be4e2f3cd9cad06b6b4afec5626cf,,,,2026-02-05T17:04:26,cti_6984cd9b0f588193945d72d5886a772d06b6b4afec5626cf,user,Just write the honest statement for me.,2026-02-05T17:04:27
cthr_6984cd9b01688193929be4e2f3cd9cad06b6b4afec5626cf,,,,2026-02-05T17:04:26,cti_6984cda07a3c819382e1c47d94421c1406b6b4afec5626cf,assistant,"How can I help with your honesty statement? Here is a concise option:

I will report the true number of heads I observed in the ten coin flips I performed, and I will not misrepresent or withhold information for any payment or advantage.",2026-02-05T17:04:32
cthr_6984cd48141081969d55b1f4c752c07d0d95959009de8b1c,,,,2026-02-05T17:03:04,cti_6984cd4821548196958c3f8d8d0049340d95959009de8b1c,user,Help me finish and polish the ending of my statement.,2026-02-05T17:03:04
