thread_id,prolific_id,qualtrics_id,condition,thread_created_at,item_id,role,message,message_created_at
cthr_69691ee339788190b8101a3da3d7ca840bc2f037bacb75e0,,,,2026-01-15T17:07:47,cti_69691f1ca05c819095eacfb4a825e93e0bc2f037bacb75e0,user,I asked you what you know about the honesty task,2026-01-15T17:08:44
cthr_69691ee339788190b8101a3da3d7ca840bc2f037bacb75e0,,,,2026-01-15T17:07:47,cti_69691f22142c8190a649a7cd6bf5affd0bc2f037bacb75e0,assistant,"How can I help with your honesty statement?

Here’s what I know about the task: Each participant flips 10 times unobserved, self-reports heads, and is paid per head. This creates incentives to misreport or shirk. Ethics and accuracy matter; a typical result center is around 5 heads. Please paste your draft for editing.",2026-01-15T17:08:50
cthr_69691ece0f188194b1242d35087d95db07cf997c59f9042b,,,,2026-01-15T17:07:25,cti_69691ece1bfc8194bed0f3b6ae7e075507cf997c59f9042b,user,What can you do?,2026-01-15T17:07:26
cthr_69691ece0f188194b1242d35087d95db07cf997c59f9042b,,,,2026-01-15T17:07:25,cti_69691ed4c11c8194a6d29350cb20cfd007cf997c59f9042b,assistant,"How can I help with your honesty statement? I can refine wording, draft a concise oath (under 40 words), or edit for clarity and ethics. I can also offer two example openings if you want.",2026-01-15T17:07:33
cthr_69681634d2208193aea5039599f2dee1040a842741716d7c,,,,2026-01-14T22:18:28,cti_69681634ecec8193894987c101137f53040a842741716d7c,user,i need help on the honest stmnt.,2026-01-14T22:18:28
cthr_69681634d2208193aea5039599f2dee1040a842741716d7c,,,,2026-01-14T22:18:28,cti_6968163eab808193b8f9a71231a95910040a842741716d7c,assistant,"How can I help with your honesty statement? Do you want me to edit an existing draft or draft a new one? I can also provide a starting phrase if you’d like.

Here are two concise options (under 40 words each):
- I will report my results honestly and traceably, recognizing incentives to misreport, and I will not fake data or omit a flip.
- I will report the number of heads observed, truthfully and to the best of my ability, and refrain from misreporting or withholding.",2026-01-14T22:18:39
cthr_69681634d2208193aea5039599f2dee1040a842741716d7c,,,,2026-01-14T22:18:28,cti_6968165456888193b570bfb312c07428040a842741716d7c,user,mhmhjdgf,2026-01-14T22:19:00
cthr_69681634d2208193aea5039599f2dee1040a842741716d7c,,,,2026-01-14T22:18:28,cti_69681659ddb08193870bcf90de2ab948040a842741716d7c,assistant,"How can I help with your honesty statement? Do you want me to edit an existing draft or draft a new one? Paste your draft, or I can provide a fresh start.

Two starter fragments (a few words each):
- I will report observed heads honestly and to the best of my ability.
- I will truthfully report the results as observed, without manipulation.",2026-01-14T22:19:06
cthr_69681634d2208193aea5039599f2dee1040a842741716d7c,,,,2026-01-14T22:18:28,cti_6968167f7c008193847d580ffbe8cc22040a842741716d7c,user,create a new one,2026-01-14T22:19:43
cthr_69681634d2208193aea5039599f2dee1040a842741716d7c,,,,2026-01-14T22:18:28,cti_69681687e9a8819394a9059b4baa14a9040a842741716d7c,assistant,"How can I help with your honesty statement?
I will report the exact number of heads observed in my 10 coin flips, honestly and completely, and will not misrepresent results, with no withholding or fabrication, irrespective of its impact on what I earn.",2026-01-14T22:19:52
cthr_696812356aa081958017eb3e49cb35da01523e3b84877ae8,,,,2026-01-14T22:01:25,cti_6968123577fc8195b5c5e10b5fd0f2e701523e3b84877ae8,user,What can you do?,2026-01-14T22:01:25
cthr_696812356aa081958017eb3e49cb35da01523e3b84877ae8,,,,2026-01-14T22:01:25,cti_6968123c49188195b1bbb7e3824fbc7a01523e3b84877ae8,assistant,"How can I help with your composition? I can refine an existing honesty statement, draft a new one under 40 words, or help you start a sentence with a few words. Share your draft or tell me your goal, and I’ll tailor it.",2026-01-14T22:01:32
cthr_696812356aa081958017eb3e49cb35da01523e3b84877ae8,,,,2026-01-14T22:01:25,cti_6968124e2b5081959a6dc89b7a2b805a01523e3b84877ae8,user,"I wanna write an oath start with not lying on the coin task, but I don't know where else",2026-01-14T22:01:50
cthr_696812356aa081958017eb3e49cb35da01523e3b84877ae8,,,,2026-01-14T22:01:25,cti_69681253f5cc8195abdc7f09c3a028e201523e3b84877ae8,assistant,"How can I help with your composition? I can refine your oath or draft a new one under 40 words. Here are two starter fragments you can begin with:
- Not lying on the coin task, I pledge to report honestly.
- Not lying on the coin task, I will disclose every result faithfully.",2026-01-14T22:01:56
cthr_69371fd9c2b88196ac14088ddbfb2e6d07c53078964a0208,,,,2025-12-08T18:58:33,cti_69371fd9d52c81968d7b4f23077039ea07c53078964a0208,user,What can you do?,2025-12-08T18:58:33
cthr_69371fd9c2b88196ac14088ddbfb2e6d07c53078964a0208,,,,2025-12-08T18:58:33,cti_69371fe07d748196b5c63a6aaf274f7407c53078964a0208,assistant,"How can I help with your honesty statement?

- I can refine your current draft.
- I can compose a new oath tailored to the coin-flip task.
- I can offer two starter lines to begin your statement.",2025-12-08T18:58:40
cthr_69371e163af08190987838402b86ae990fc9a6420677bfb1,,,,2025-12-08T18:51:02,cti_69371e1644dc8190839eaa3bf9f0cff00fc9a6420677bfb1,user,What can you do?,2025-12-08T18:51:02
cthr_69371e163af08190987838402b86ae990fc9a6420677bfb1,,,,2025-12-08T18:51:02,cti_69371e1d9bd0819088f4add5b595c5400fc9a6420677bfb1,assistant,"How can I help you with your honesty statement?

I can:
- Edit an existing statement for clarity and ethics.
- Draft a new, concise statement tailored to this task.
- Refine tone to emphasize honesty, accountability, and ethics.
- Check alignment with the study setup and incentives.

Would you like me to start with a draft or edit your current version? If you want starting phrasing, here are two options (each under 40 words):
- “I will report my total number of heads truthfully, regardless of personal gain.”
- “I will not misreport, nor shirk the task, and I will disclose any deviations.”",2025-12-08T18:51:10
cthr_69371e163af08190987838402b86ae990fc9a6420677bfb1,,,,2025-12-08T18:51:02,cti_69371e901af08190b4640a3adec606e20fc9a6420677bfb1,user,"Please compose a brief “honesty statement” that you think is appropriate and relevant to this task and this group.

 

Make sure the statement is in your own words and is a minimum of 25.",2025-12-08T18:53:04
cthr_69371e163af08190987838402b86ae990fc9a6420677bfb1,,,,2025-12-08T18:51:02,cti_69371e9779d08190bddc78ab504299eb0fc9a6420677bfb1,assistant,"I will report my total number of heads truthfully for this task, accepting the ethical obligation to avoid misreporting or shirking, and I will disclose any discrepancies in my reporting to uphold fairness and integrity.",2025-12-08T18:53:11
cthr_69371c3e81548197bdf63c495a82349e0913e4081da0f8c5,,,,2025-12-08T18:43:10,cti_69371c3e90748197bc09c5ee647e11f60913e4081da0f8c5,user,Hi. help me finish my statement: I promoise to report,2025-12-08T18:43:10
cthr_69371c3e81548197bdf63c495a82349e0913e4081da0f8c5,,,,2025-12-08T18:43:10,cti_69371c49cce48197bfcfdc805755665d0913e4081da0f8c5,assistant,"How can I help with your composition?

I can help finish your statement. Here are two starting options:
- I promise to report all results, honestly.
- I promise to report truthfully, regardless of incentives.",2025-12-08T18:43:21
cthr_69371c3e81548197bdf63c495a82349e0913e4081da0f8c5,,,,2025-12-08T18:43:10,cti_69371c86bd2881979c8ae34f566420500913e4081da0f8c5,user,"I like this but dont really understand the incetives part: I promise to report truthfully, regardless of incentives.",2025-12-08T18:44:22
cthr_69371c3e81548197bdf63c495a82349e0913e4081da0f8c5,,,,2025-12-08T18:43:10,cti_69371c8d50bc8197b0d8c585601360f50913e4081da0f8c5,assistant,"How can I help with your composition?

Brief note: incentives mean you could earn more by lying about your heads, so you commit to honesty even when lying seems profitable.

Two options under 40 words:
- I promise to report all results honestly, even if lying could earn me more.
- I promise to report truthfully, even when misreporting would pay more.",2025-12-08T18:44:29
cthr_6937011db99c81939432742d2809acb803704e6048b5713f,,,,2025-12-08T16:47:25,cti_6937011dc8588193921bacf50668e87e03704e6048b5713f,user,write my statement,2025-12-08T16:47:25
cthr_6937011db99c81939432742d2809acb803704e6048b5713f,,,,2025-12-08T16:47:25,cti_6937012e08548193bece3531e164b63103704e6048b5713f,assistant,"How can I help you with your composition?

I pledge to report the number of heads I actually observed in my 10 coin flips, report honestly without exaggeration or omission, and refrain from shirking or altering results for any compensation.",2025-12-08T16:47:42
cthr_69324573a638819498abb55f31ea565b01eee9568ab134ff,,,,2025-12-05T02:37:39,cti_69324573b4508194a20e3ec970d568d101eee9568ab134ff,user,What can you do?,2025-12-05T02:37:39
cthr_69324573a638819498abb55f31ea565b01eee9568ab134ff,,,,2025-12-05T02:37:39,cti_6932457a4ab88194b61fa413be140e8601eee9568ab134ff,assistant,"I can help you refine, edit, or compose an honesty statement for this coin-flipping task. If you have already written something, I can review and improve it. If you need help starting, I can suggest a draft. How would you like to proceed?",2025-12-05T02:37:47
cthr_6932453e34548195832924a8d652681a00320763b6f7577f,,,,2025-12-05T02:36:46,cti_6932453e428c8195bc16b708b569725400320763b6f7577f,user,help me write an honesty statement. I just need the begining,2025-12-05T02:36:46
cthr_6932453e34548195832924a8d652681a00320763b6f7577f,,,,2025-12-05T02:36:46,cti_69324542749c819585d0fe066fe4458900320763b6f7577f,assistant,"Of course! Here’s a way to start your honesty statement:

""I certify that I truthfully reported the number of heads I observed in my coin flips...""",2025-12-05T02:36:51
cthr_6932453e34548195832924a8d652681a00320763b6f7577f,,,,2025-12-05T02:36:46,cti_6932454e6b9081959de93c7a6518330000320763b6f7577f,user,now finish it,2025-12-05T02:37:02
cthr_6932453e34548195832924a8d652681a00320763b6f7577f,,,,2025-12-05T02:36:46,cti_69324553310c8195bc523622c3e716bb00320763b6f7577f,assistant,...and that I performed all 10 coin flips myself without altering or misrepresenting the results.,2025-12-05T02:37:08
cthr_6932440e317081958c2b9f6cf602836f036cc15267792b33,,,,2025-12-05T02:31:42,cti_6932440e3d948195a879b5cdd766102c036cc15267792b33,user,Help me write an honesty statement. I just need to beginning.,2025-12-05T02:31:42
cthr_6932440e317081958c2b9f6cf602836f036cc15267792b33,,,,2025-12-05T02:31:42,cti_69324415a63481959171eff73bc3fc9a036cc15267792b33,assistant,I affirm that I have truthfully reported the number of heads I observed after flipping the coin 10 times…,2025-12-05T02:31:50
cthr_693243b69a6881979908754362e21c7801ee4681dd249319,,,,2025-12-05T02:30:14,cti_693243b6a8cc81979a3d5e72e5989af201ee4681dd249319,user,Help me write an honesty statement. I just need to start.,2025-12-05T02:30:14
cthr_693243b69a6881979908754362e21c7801ee4681dd249319,,,,2025-12-05T02:30:14,cti_693243bd88548197a0f56ecb2a2896ae01ee4681dd249319,assistant,"Sure! Would you like to share a draft you’ve started, or would you like me to suggest an opening phrase for your statement?",2025-12-05T02:30:22
cthr_69324397fd9481978f91e4e44f9c88460e15b7407e4ba1cf,,,,2025-12-05T02:29:43,cti_69324398191881978c24c52c7c21d3710e15b7407e4ba1cf,user,help me write an honesty statement,2025-12-05T02:29:44
cthr_69324397fd9481978f91e4e44f9c88460e15b7407e4ba1cf,,,,2025-12-05T02:29:43,cti_6932439f065c8197a730da6e9cc75c8d0e15b7407e4ba1cf,assistant,"Of course! Do you already have a draft or some ideas you’d like to work from? If you share what you have, I can help you polish or refine it. If not, I can help you get started.",2025-12-05T02:29:52
