thread_id,prolific_id,qualtrics_id,condition,thread_created_at,item_id,role,message,message_created_at
cthr_69b5938cb95081939b6157f9e604a5860a40872c9cafc70a,march14,haritima349,,2026-03-14T16:57:48,cti_69b5938ccfa481938ea6deee8674e4d90a40872c9cafc70a,user,edit my statement 1,2026-03-14T16:57:48
cthr_69b5938cb95081939b6157f9e604a5860a40872c9cafc70a,march14,haritima349,,2026-03-14T16:57:48,cti_69b593920b3c8193a8cac5d6d9dc0b040a40872c9cafc70a,assistant,"How can I help with your composition?

Please paste your statement 1, and I’ll edit it to be concise (under 40 words). If you’d like, I can offer two brief edits afterward.",2026-03-14T16:57:54
cthr_69b5938cb95081939b6157f9e604a5860a40872c9cafc70a,march14,haritima349,,2026-03-14T16:57:48,cti_69b593a2d5cc819388bef99db653aa990a40872c9cafc70a,user,"I believe I should never lie, and misreport.",2026-03-14T16:58:10
cthr_69b5938cb95081939b6157f9e604a5860a40872c9cafc70a,march14,haritima349,,2026-03-14T16:57:48,cti_69b593a797088193b7f6256183f3d8730a40872c9cafc70a,assistant,"Here are two concise edits under 40 words:

- I will never lie or misreport my results.
- I commit to reporting my results truthfully, without deception.",2026-03-14T16:58:15
cthr_69b50b9659c08193a3ca61bd0ef9d62b02395a97f487b7bd,test678,R_567,,2026-03-14T07:17:42,cti_69b50b9665f08193a681ee06fa13a56302395a97f487b7bd,user,no open ai messages,2026-03-14T07:17:42
cthr_69b50b9659c08193a3ca61bd0ef9d62b02395a97f487b7bd,test678,R_567,,2026-03-14T07:17:42,cti_69b50b9b9c9081939f1f4e6e6163444402395a97f487b7bd,assistant,"How can I help with your honesty statement? I can edit your draft or draft a sentence for you. If you’d like starter fragments, I can provide two brief options to begin your line.",2026-03-14T07:17:47
cthr_69b50b9659c08193a3ca61bd0ef9d62b02395a97f487b7bd,test678,R_567,,2026-03-14T07:17:42,cti_69b50c1e723c8193984a915c76cfff5902395a97f487b7bd,user,really,2026-03-14T07:19:58
cthr_69b50b9659c08193a3ca61bd0ef9d62b02395a97f487b7bd,test678,R_567,,2026-03-14T07:17:42,cti_69b50c22e4948193a8164bde068142c902395a97f487b7bd,assistant,"How can I help with your honesty statement? I can edit your draft or draft a sentence. If you’d like starter fragments, here are two brief options to begin your line:
- I will report honestly
- I will not misreport counts",2026-03-14T07:20:03
cthr_69b50b9659c08193a3ca61bd0ef9d62b02395a97f487b7bd,test678,R_567,,2026-03-14T07:17:42,cti_69b50c6144388193861c775c1f6c2bfc02395a97f487b7bd,user,yay!,2026-03-14T07:21:05
cthr_69b50b9659c08193a3ca61bd0ef9d62b02395a97f487b7bd,test678,R_567,,2026-03-14T07:17:42,cti_69b50c650d3c81938574fdd25a86f51402395a97f487b7bd,assistant,"Great! How would you like help with your honesty statement? I can edit your draft or draft a sentence for you, keeping it under 40 words.

Two starter options:
- I will report honestly about all flips.
- I will not misreport heads and will disclose uncertainty.",2026-03-14T07:21:09
cthr_69b50b9659c08193a3ca61bd0ef9d62b02395a97f487b7bd,test678,R_567,,2026-03-14T07:17:42,cti_69b50d420abc8193a5f3d4febcb890ec02395a97f487b7bd,user,let's get this rolling,2026-03-14T07:24:50
cthr_69b50b9659c08193a3ca61bd0ef9d62b02395a97f487b7bd,test678,R_567,,2026-03-14T07:17:42,cti_69b50d45d2a48193ab75dcdc963861fc02395a97f487b7bd,assistant,"How can I help with your honesty statement? I can edit your draft or draft a sentence under 40 words.

Starting fragment (choose or edit):
- I will report honestly about all 10 flips.
- I will not misreport heads and will disclose uncertainty.",2026-03-14T07:24:54
cthr_69b50b07c5488190ba840d4c55176919067877efdbeb91de,test123,R_999,,2026-03-14T07:15:19,cti_69b50b07cbec8190971e6d8ee48a1f10067877efdbeb91de,user,hopefully done,2026-03-14T07:15:19
cthr_69b50b07c5488190ba840d4c55176919067877efdbeb91de,test123,R_999,,2026-03-14T07:15:19,cti_69b50b0ac364819080be2158734e8ca5067877efdbeb91de,assistant,"How can I help with your honesty statement? If you share your draft, I’ll refine it. I can also draft a brief starting line or two examples (each under 40 words).",2026-03-14T07:15:23
cthr_69b50b07c5488190ba840d4c55176919067877efdbeb91de,test123,R_999,,2026-03-14T07:15:19,cti_69b50b3e32688190b6cc374881330efa067877efdbeb91de,user,new one,2026-03-14T07:16:14
cthr_69b50b07c5488190ba840d4c55176919067877efdbeb91de,test123,R_999,,2026-03-14T07:15:19,cti_69b50b42432c8190b8a742b23e42096b067877efdbeb91de,assistant,"How can I help with your honesty statement? If you share your draft, I’ll refine it. I can also draft a brief starting line or two examples (each under 40 words).

Two example lines (under 40 words each):
- I will report the total heads I observed truthfully and refrain from misreporting or shirking the task.
- I will report honestly, acknowledge uncertainty, and not misrepresent results or skip the task.",2026-03-14T07:16:18
cthr_69b509ca58b88195bee8e8b138fc62800ca559dca4e08394,test123,R_999,,2026-03-14T07:10:02,cti_69b509ca67348195a9ac769ba008506e0ca559dca4e08394,user,too many new sessions,2026-03-14T07:10:02
cthr_69b509ca58b88195bee8e8b138fc62800ca559dca4e08394,test123,R_999,,2026-03-14T07:10:02,cti_69b509cefedc819586d4c6170c438a5a0ca559dca4e08394,assistant,"How can I help with your composition? If you have a draft, share it and I’ll refine it.

If you want a quick start, here are two opening fragments:
- I will report truthfully the number of heads observed
- I commit to honesty in reporting outcomes",2026-03-14T07:10:07
cthr_69b50821510c819392f49a13866a137000775580c1612385,test123,R_999,,2026-03-14T07:02:57,cti_69b5082162688193a7b14e0da81abf8600775580c1612385,user,test,2026-03-14T07:02:57
cthr_69b50821510c819392f49a13866a137000775580c1612385,test123,R_999,,2026-03-14T07:02:57,cti_69b5082494648193bda34d2f385cf41100775580c1612385,assistant,"How can I help with your composition? I can refine your honesty statement or draft a brief version (under 40 words) tailored to the coin-flip task and its ethics. If you want a starting line, I can provide a few options.",2026-03-14T07:03:00
cthr_69b507963f2c8197aae65b87b832ca9c0d9220accbf94b52,test123,R_999,,2026-03-14T07:00:38,cti_69b507964c008197a5cc1bf29885c7680d9220accbf94b52,user,is this new session,2026-03-14T07:00:38
cthr_69b507963f2c8197aae65b87b832ca9c0d9220accbf94b52,test123,R_999,,2026-03-14T07:00:38,cti_69b5079a5a608197b3537dafb04dab250d9220accbf94b52,assistant,"Yes, this is a new session. How would you like to refine your honesty statement? If you have a draft, share it and I’ll help tighten it.",2026-03-14T07:00:42
cthr_69b50748b84c81909a41e579e61f1fab000e20f8edd9e054,test123,R_999,,2026-03-14T06:59:20,cti_69b50748bf3481909c58526dfe02a116000e20f8edd9e054,user,remember to pass pid in the browser,2026-03-14T06:59:20
cthr_69b50748b84c81909a41e579e61f1fab000e20f8edd9e054,test123,R_999,,2026-03-14T06:59:20,cti_69b5074c51e4819080e6feb258b27836000e20f8edd9e054,assistant,"How can I help refine your honesty statement for the coin-flip task? I can draft or edit it to emphasize ethics and honesty. If you want, I can start with a short prompt.",2026-03-14T06:59:24
cthr_69b50748b84c81909a41e579e61f1fab000e20f8edd9e054,test123,R_999,,2026-03-14T06:59:20,cti_69b5075b5e4c8190bdc8511a8ffd00be000e20f8edd9e054,user,test,2026-03-14T06:59:39
cthr_69b50748b84c81909a41e579e61f1fab000e20f8edd9e054,test123,R_999,,2026-03-14T06:59:20,cti_69b5075dca0c8190bb6e87d38f21628b000e20f8edd9e054,assistant,"How can I help refine your honesty statement for the coin-flip task? I can draft or edit it to emphasize ethics and honesty.

Two starter prompts (under 40 words each):
- I pledge to report the true number of heads, not to exaggerate or shirk, and to uphold fairness in this study.
- I commit to honest reporting of every flip, recognizing that trust and integrity sustain the research.",2026-03-14T06:59:42
cthr_69b506eeac18819383cc14c917d89a560b4e5b7a8e383049,,,,2026-03-14T06:57:50,cti_69b506eeb9248193a6589964448f098c0b4e5b7a8e383049,user,well I am truthful,2026-03-14T06:57:50
cthr_69b506eeac18819383cc14c917d89a560b4e5b7a8e383049,,,,2026-03-14T06:57:50,cti_69b506f2f3e0819383ace75e1d1367400b4e5b7a8e383049,assistant,"How can I help you with your honesty statement? I can refine what you have, or compose a concise version under 40 words.

Here are two brief options:
- I pledge to report my observed heads honestly, recognizing that misreporting undermines the study and the trust of others; I will only report totals I genuinely counted.
- I commit to truthful reporting of my heads, accepting any discrepancy as a consequence of my own actions, and I will not misreport to gain compensation.",2026-03-14T06:57:56
cthr_69b5053bd2208194a3dc5b82b0f0e03c0b129a75d4a3efe1,test123,R_999,,2026-03-14T06:50:35,cti_69b5053bebac81949f8c3e1d922badb30b129a75d4a3efe1,user,hopefuilly!,2026-03-14T06:50:35
cthr_69b5053bd2208194a3dc5b82b0f0e03c0b129a75d4a3efe1,test123,R_999,,2026-03-14T06:50:35,cti_69b50540b1048194aa393dc23edc2a220b129a75d4a3efe1,assistant,"How can I help with your honesty statement? I can edit your draft, draft a new version (under 40 words), or provide two example lines. Share what you have, or tell me the tone you want.",2026-03-14T06:50:40
cthr_69b5053bd2208194a3dc5b82b0f0e03c0b129a75d4a3efe1,test123,R_999,,2026-03-14T06:50:35,cti_69b5069f5fd481948394b6a7119bb55a0b129a75d4a3efe1,user,tes,2026-03-14T06:56:31
cthr_69b5053bd2208194a3dc5b82b0f0e03c0b129a75d4a3efe1,test123,R_999,,2026-03-14T06:50:35,cti_69b506a1e5088194800484a710ca2d300b129a75d4a3efe1,assistant,"How can I help with your honesty statement? I can edit your draft, draft a new version (under 40 words), or give two example lines. Share what you have, or tell me the tone you want.",2026-03-14T06:56:34
cthr_69b50527d5488197a6d768223c5ab24709584e61e7392900,test123,R_999,,2026-03-14T06:50:15,cti_69b50527e1b8819797068db620b998d309584e61e7392900,user,"Edit my statement for clarity, tone, and structure.",2026-03-14T06:50:15
cthr_69b500670c1c819682090e94cfedbf8808bbc945548a91fc,test123,R_999,,2026-03-14T06:29:59,cti_69b500671a488196a20a5aca18fcb22a08bbc945548a91fc,user,test with fake ids,2026-03-14T06:29:59
cthr_69b500670c1c819682090e94cfedbf8808bbc945548a91fc,test123,R_999,,2026-03-14T06:29:59,cti_69b5006c632c8196955f496f5e003e8e08bbc945548a91fc,assistant,"How can I help you with your honesty statement?

I can’t assist with fake IDs. I can help you craft or refine your honesty statement about the coin task. If you’d like a starter, here are a few words to begin: I will report my total heads honestly.",2026-03-14T06:30:06
cthr_69b500670c1c819682090e94cfedbf8808bbc945548a91fc,test123,R_999,,2026-03-14T06:29:59,cti_69b50105ef60819691b9eb7caf0cf33708bbc945548a91fc,user,test,2026-03-14T06:32:37
cthr_69b500670c1c819682090e94cfedbf8808bbc945548a91fc,test123,R_999,,2026-03-14T06:29:59,cti_69b50109e67081969be1479024deec6a08bbc945548a91fc,assistant,"How can I help you with your honesty statement?

Here are two starter examples (under 40 words each):
- I will report my total number of heads honestly, even when misreporting could benefit me.
- I will document my observed results truthfully, resisting any incentive to misrepresent my 10-flip outcomes.",2026-03-14T06:32:42
cthr_69b500670c1c819682090e94cfedbf8808bbc945548a91fc,test123,R_999,,2026-03-14T06:29:59,cti_69b5019576d48196a8327e79b7bda14008bbc945548a91fc,user,test,2026-03-14T06:35:01
cthr_69b500670c1c819682090e94cfedbf8808bbc945548a91fc,test123,R_999,,2026-03-14T06:29:59,cti_69b5019b1d188196bef26886387dcf4008bbc945548a91fc,assistant,"How can I help you with your honesty statement?

Here are two starter examples (under 40 words each):
- I will report my total heads honestly, regardless of incentives to misreport.
- I will record my 10-flip results truthfully, resisting any urge to lie for gain.",2026-03-14T06:35:07
cthr_69b50029631881948070f6235a5b34b202798d9989a2145e,,,,2026-03-14T06:28:57,cti_69b50029795c8194ab93ee85999b23f802798d9989a2145e,user,test for the day,2026-03-14T06:28:57
cthr_69b50029631881948070f6235a5b34b202798d9989a2145e,,,,2026-03-14T06:28:57,cti_69b5002e1c6481948760f25f3daa6d3e02798d9989a2145e,assistant,"How can I help with your honesty statement today?

I can edit your current draft or draft a concise version (under 40 words). If you want a starter, I can provide just a few words to begin your sentence. Would you like to share your draft?",2026-03-14T06:29:02
cthr_69b4f19566d0819599bfe1cc46f260d20977b2be9a645148,,,,2026-03-14T05:26:45,cti_69b4f1958db88195aea15bc7f584d24b0977b2be9a645148,user,trying now,2026-03-14T05:26:45
cthr_69b4f19566d0819599bfe1cc46f260d20977b2be9a645148,,,,2026-03-14T05:26:45,cti_69b4f1982f748195a43467eb621e0e0a0977b2be9a645148,assistant,"How can I help with your honesty statement? I can refine your draft or compose a brief starter from scratch.

If you’d like options, I can offer two sample starters (under 40 words each). Tell me which direction you prefer.",2026-03-14T05:26:48
cthr_69b4f19566d0819599bfe1cc46f260d20977b2be9a645148,,,,2026-03-14T05:26:45,cti_69b4f1a127a48195a157992d8e87d40c0977b2be9a645148,user,not getting,2026-03-14T05:26:57
cthr_69b4f19566d0819599bfe1cc46f260d20977b2be9a645148,,,,2026-03-14T05:26:45,cti_69b4f1a4fb9c819580e3e40b7ae7679d0977b2be9a645148,assistant,"How can I help with your honesty statement? If you share your draft, I’ll refine it. If you’d like starters, here are two brief options (under 40 words each):

1) I pledge to report my exact number of heads truthfully, regardless of outcome or payoff.

2) I commit to truthful reporting of all 10 flips and will not misreport or shirk the task.",2026-03-14T05:27:01
cthr_69b4f092731081949777aa26781f687804f29b40cdb5a878,,,,2026-03-14T05:22:26,cti_69b4f0929dcc81949b9e261d8b72515204f29b40cdb5a878,user,test,2026-03-14T05:22:26
cthr_69b4f092731081949777aa26781f687804f29b40cdb5a878,,,,2026-03-14T05:22:26,cti_69b4f0955d04819499d867fca154b6b804f29b40cdb5a878,assistant,"How can I help with your honesty statement? I can refine your draft or compose one for you. If you want a starter, I can provide a few words to begin. Would you like me to start?",2026-03-14T05:22:29
cthr_69b4f04592988195b2e722f07f16a3b801213f8721f3aaa3,,,,2026-03-14T05:21:09,cti_69b4f045a0e88195a5e5a42ae8b0a2e901213f8721f3aaa3,user,ok,2026-03-14T05:21:09
cthr_69b4f04592988195b2e722f07f16a3b801213f8721f3aaa3,,,,2026-03-14T05:21:09,cti_69b4f047fd548195aff5ff6c9331059d01213f8721f3aaa3,assistant,"How can I help with your honesty statement? I can refine your current draft or compose a version for you. If you’d like options, I can offer two example starters. How would you like to proceed?",2026-03-14T05:21:12
cthr_69b4ef32d3488195be1141d0a87c14760d9b8a0602447059,,,,2026-03-14T05:16:34,cti_69b4ef32e2008195871f3b48270f16640d9b8a0602447059,user,test,2026-03-14T05:16:34
cthr_69b4ef32d3488195be1141d0a87c14760d9b8a0602447059,,,,2026-03-14T05:16:34,cti_69b4ef37651c81959ab573747e3d331b0d9b8a0602447059,assistant,"How can I help with your honesty statement? I can refine your current draft or compose a new one. If you’d like me to start, I can provide a few opening fragments. Please share your draft or needs.",2026-03-14T05:16:39
cthr_69b4ef32d3488195be1141d0a87c14760d9b8a0602447059,,,,2026-03-14T05:16:34,cti_69b4ef3c55448195882ed3e3a609fa7c0d9b8a0602447059,user,now,2026-03-14T05:16:44
cthr_69b4ef32d3488195be1141d0a87c14760d9b8a0602447059,,,,2026-03-14T05:16:34,cti_69b4ef409dcc8195b461b641a25f1e310d9b8a0602447059,assistant,"How can I help with your honesty statement? I can refine your draft or compose a new one. Here are two opening fragments you can start with (each under 40 words):

- I report honestly, even when the odds seem low.
- I will report the total heads as observed.",2026-03-14T05:16:48
cthr_69b4ef32d3488195be1141d0a87c14760d9b8a0602447059,,,,2026-03-14T05:16:34,cti_69b4efa3b774819584c491ce8fbc401f0d9b8a0602447059,user,send,2026-03-14T05:18:27
cthr_69b4ef32d3488195be1141d0a87c14760d9b8a0602447059,,,,2026-03-14T05:16:34,cti_69b4efa9c4dc8195b4f814cfbaddf7880d9b8a0602447059,assistant,"I report the number of heads I observed, not what might gain me money or avoid effort. I will not misreport or shirk, and I acknowledge the ethical duty to accuracy in this study.",2026-03-14T05:18:33
cthr_69b4e8994948819484dceaff4f87579108e376c3790ba3e6,test123,R_999,,2026-03-14T04:48:25,cti_69b4e8995e5c8194bb56b06e40640e0908e376c3790ba3e6,user,hello,2026-03-14T04:48:25
cthr_69b4e8994948819484dceaff4f87579108e376c3790ba3e6,test123,R_999,,2026-03-14T04:48:25,cti_69b4e89f03108194a3a00a6c10768ebb08e376c3790ba3e6,assistant,"How can I help with your honesty statement? I can refine your draft or compose a concise version (under 40 words). Do you want to start from a few words, or share your current draft for edits?",2026-03-14T04:48:31
cthr_69b4e7b894a48197a8bbf72c74fba4d90580fa62ad03e6c3,,,,2026-03-14T04:44:40,cti_69b4e7b8a8f48197893989182b9c14960580fa62ad03e6c3,user,test,2026-03-14T04:44:40
cthr_69b4e7b894a48197a8bbf72c74fba4d90580fa62ad03e6c3,,,,2026-03-14T04:44:40,cti_69b4e7bd44ac819793c603da37b8c42b0580fa62ad03e6c3,assistant,"How can I help with your honesty statement? If you share a draft, I’ll refine it. If you’re starting from scratch, I can offer a brief opener. For example: “I will report my results honestly.” or “I will disclose my counts truthfully.”",2026-03-14T04:44:45
cthr_69b4e7b894a48197a8bbf72c74fba4d90580fa62ad03e6c3,,,,2026-03-14T04:44:40,cti_69b4e7c4267081979057546628aee95b0580fa62ad03e6c3,user,no,2026-03-14T04:44:52
cthr_69b4e7b894a48197a8bbf72c74fba4d90580fa62ad03e6c3,,,,2026-03-14T04:44:40,cti_69b4e7c763e08197a6b8678292b53e8a0580fa62ad03e6c3,assistant,"How would you like to proceed with your honesty statement? I can refine an existing draft, or offer a two-word starter to begin: “I report” or “I disclose.”",2026-03-14T04:44:55
cthr_69b4e6ab30288195922a111124fa062e04f969bc3d3ae3cc,test123,R_999,,2026-03-14T04:40:11,cti_69b4e6ab447481958e745ab8b394f4d004f969bc3d3ae3cc,user,no messages,2026-03-14T04:40:11
cthr_69b4e6ab30288195922a111124fa062e04f969bc3d3ae3cc,test123,R_999,,2026-03-14T04:40:11,cti_69b4e6ade3748195bc742d7b5217994e04f969bc3d3ae3cc,assistant,"How can I help with your honesty statement? I can refine your existing draft or compose a concise version. Tell me your current text, or the stance you want to convey.",2026-03-14T04:40:13
cthr_69b4e6ab30288195922a111124fa062e04f969bc3d3ae3cc,test123,R_999,,2026-03-14T04:40:11,cti_69b4e6b87d748195a60593a68ac879a604f969bc3d3ae3cc,user,ok,2026-03-14T04:40:24
cthr_69b4e6ab30288195922a111124fa062e04f969bc3d3ae3cc,test123,R_999,,2026-03-14T04:40:11,cti_69b4e6bf857c81958b64edaaeb69ae9504f969bc3d3ae3cc,assistant,"How can I help with your honesty statement? I can refine your draft or compose a concise version (under 40 words). If you’d like examples, here are two options:

- I will honestly report the total number of heads from 10 flips and will not misreport or alter results.
- I pledge to report only the true number of heads observed and to refrain from cheating or falsifying results.",2026-03-14T04:40:32
cthr_69b4e52b40b88195ae9f6366b5c0376e0b869b11f7f12321,test123,R_999,,2026-03-14T04:33:47,cti_69b4e52b4c6c819587ce44d62b083faf0b869b11f7f12321,user,really!,2026-03-14T04:33:47
cthr_69b4e52b40b88195ae9f6366b5c0376e0b869b11f7f12321,test123,R_999,,2026-03-14T04:33:47,cti_69b4e530b9f48195b5427d791c8c17030b869b11f7f12321,assistant,"How can I help with your honesty statement? I can refine an existing draft or help start a concise version.

Possible starter fragments:
- I will report
- I promise to report",2026-03-14T04:33:53
cthr_69b4e52b40b88195ae9f6366b5c0376e0b869b11f7f12321,test123,R_999,,2026-03-14T04:33:47,cti_69b4e537f29481959b083bf42f1fe78c0b869b11f7f12321,user,ok,2026-03-14T04:33:59
cthr_69b4e52b40b88195ae9f6366b5c0376e0b869b11f7f12321,test123,R_999,,2026-03-14T04:33:47,cti_69b4e53b0fcc8195bd146c428c6e65ae0b869b11f7f12321,assistant,"How can I help with your honesty statement? I can refine an existing draft or help start a concise version.

Two starter options (under 40 words each):
- I will report the number of heads I actually observed, honestly and fully, regardless of incentive.
- I promise to report my true total of heads, without fabrication or evasion, even when incentives tempt misreporting.",2026-03-14T04:34:03
cthr_69b4e2e98abc819498bfe5e12df8da55051d3b1642f1d3ae,,,,2026-03-14T04:24:09,cti_69b4e2e9977c8194b70735f50b8ce1ef051d3b1642f1d3ae,user,final tes!,2026-03-14T04:24:09
cthr_69b4e2e98abc819498bfe5e12df8da55051d3b1642f1d3ae,,,,2026-03-14T04:24:09,cti_69b4e2f04180819490dd594e9198685d051d3b1642f1d3ae,assistant,"How can I help with your honesty statement? I can refine your draft, or draft a concise option (under 40 words). Here are two starter examples:
- I will report my observed number of heads honestly, regardless of incentives to misreport.
- I will truthfully declare the total of my ten flips, resisting any incentive to misreport.",2026-03-14T04:24:16
cthr_69b4e2e98abc819498bfe5e12df8da55051d3b1642f1d3ae,,,,2026-03-14T04:24:09,cti_69b4e2fa87bc8194a91a14f78fbac73e051d3b1642f1d3ae,user,looks like working!@,2026-03-14T04:24:26
cthr_69b4e2e98abc819498bfe5e12df8da55051d3b1642f1d3ae,,,,2026-03-14T04:24:09,cti_69b4e2fff2048194ba5ad29394f4787d051d3b1642f1d3ae,assistant,"How can I help with your honesty statement? I can refine your draft, or draft a concise option (under 40 words). Here are two refined options:
- I will report the actual number of heads from my ten flips, honestly, regardless of incentives to misreport.
- I will truthfully declare the total heads from my ten flips, resisting any incentive to misreport.",2026-03-14T04:24:32
cthr_69b4e2e98abc819498bfe5e12df8da55051d3b1642f1d3ae,,,,2026-03-14T04:24:09,cti_69b4e323fbe881948a0fec9718554a32051d3b1642f1d3ae,user,really why no messages,2026-03-14T04:25:07
cthr_69b4e2e98abc819498bfe5e12df8da55051d3b1642f1d3ae,,,,2026-03-14T04:24:09,cti_69b4e32846c48194a007806072f8220e051d3b1642f1d3ae,assistant,"I’m here to help with your honesty statement. Do you want me to refine an existing draft or draft a new option (under 40 words)? If you want a start, give me a few words.",2026-03-14T04:25:12
cthr_69b4e2e98abc819498bfe5e12df8da55051d3b1642f1d3ae,,,,2026-03-14T04:24:09,cti_69b4e34e625c81949a8265b8bd242d72051d3b1642f1d3ae,user,no,2026-03-14T04:25:50
cthr_69b4e2e98abc819498bfe5e12df8da55051d3b1642f1d3ae,,,,2026-03-14T04:24:09,cti_69b4e35140408194a2fedf5feca5d10b051d3b1642f1d3ae,assistant,"How can I help with your honesty statement? If you want later, I can refine your draft or draft a new option (under 40 words). Want a short starting phrase?",2026-03-14T04:25:53
cthr_69b4e042a4808193a212aa9a6990f2bf034dd5c90cac673e,,,,2026-03-14T04:12:50,cti_69b4e042b2f8819383bb49904a47652d034dd5c90cac673e,user,test,2026-03-14T04:12:50
cthr_69b4e042a4808193a212aa9a6990f2bf034dd5c90cac673e,,,,2026-03-14T04:12:50,cti_69b4e046a45081939cea22fd2f5189c0034dd5c90cac673e,assistant,"How can I help with your honesty statement? If you’d like a quick start, here are two starters:
- I will report truthfully
- I will not misreport my results",2026-03-14T04:12:54
cthr_69b4e042a4808193a212aa9a6990f2bf034dd5c90cac673e,,,,2026-03-14T04:12:50,cti_69b4e04aaf3081938553463899088981034dd5c90cac673e,user,not,2026-03-14T04:12:58
cthr_69b4e042a4808193a212aa9a6990f2bf034dd5c90cac673e,,,,2026-03-14T04:12:50,cti_69b4e04d73508193a7c5a97b5256ea5b034dd5c90cac673e,assistant,"How would you like to proceed with your honesty statement? I can refine your current draft, or draft a new one. If you want a brief starter, I can begin with: “I will report my results truthfully.”",2026-03-14T04:13:01
cthr_69b4e042a4808193a212aa9a6990f2bf034dd5c90cac673e,,,,2026-03-14T04:12:50,cti_69b4e05ad7748193819bd03fc7cce67e034dd5c90cac673e,user,thncx,2026-03-14T04:13:14
cthr_69b4e042a4808193a212aa9a6990f2bf034dd5c90cac673e,,,,2026-03-14T04:12:50,cti_69b4e05ded308193a9f43fcc88ae7d27034dd5c90cac673e,assistant,"How can I help with your honesty statement? I can refine your draft or draft a new one. Here are two starters:

- I will report my results truthfully, even when tempted to misreport.
- I will not misreport my heads and will follow the procedure.",2026-03-14T04:13:18
cthr_69b4de9671e48196bc59329d8336e27a079c510462b7aa83,,,,2026-03-14T04:05:42,cti_69b4de968cd481968b0f626d11f3f929079c510462b7aa83,user,test1,2026-03-14T04:05:42
cthr_69b4de9671e48196bc59329d8336e27a079c510462b7aa83,,,,2026-03-14T04:05:42,cti_69b4de9afe708196b6617f384f3237f2079c510462b7aa83,assistant,"How can I help you with your composition?

I can refine an existing honesty statement you’ve started, or draft a concise one for this task. Tell me if you want a formal or neutral tone, and any line you want to include.

Would you like me to review and improve your current draft, or start a new 40-word statement?",2026-03-14T04:05:47
cthr_69b4de9671e48196bc59329d8336e27a079c510462b7aa83,,,,2026-03-14T04:05:42,cti_69b4dea11f00819682b15266f971b731079c510462b7aa83,user,now noth,2026-03-14T04:05:53
cthr_69b4de9671e48196bc59329d8336e27a079c510462b7aa83,,,,2026-03-14T04:05:42,cti_69b4dea45a188196afc6f04439653267079c510462b7aa83,assistant,"How can I help you with your composition?

Would you like me to refine an existing honesty statement you’ve started, or draft a new 40-word statement? Tell me the tone (formal or neutral) and any line you want to include.",2026-03-14T04:05:56
cthr_69b4de3de02c8190bffc019a0e8fcfaa03e1c9a3cb8c415a,,,,2026-03-14T04:04:13,cti_69b4de3de69c8190afd09791c09a224203e1c9a3cb8c415a,user,test2,2026-03-14T04:04:13
