thread_id,prolific_id,qualtrics_id,condition,thread_created_at,item_id,role,message,message_created_at
cthr_6984cd48141081969d55b1f4c752c07d0d95959009de8b1c,,,,2026-02-05T17:03:04,cti_6984cd4ef1048196abe33f2ef8f060850d95959009de8b1c,assistant,"How can I help refine your ending?

I can finish your ending. Here are two concise options (under 40 words each):

Option A:
I commit to reporting the true number of heads I observe, to the best of my ability, and to honesty, even when incentives tempt misreporting.

Option B:
I will report honestly the number of heads observed, accepting the consequences of accuracy rather than shortcuts, and I will refrain from any misrepresentation.",2026-02-05T17:03:11
cthr_6984ccb783f881968aebdc3261a9c9c408dcbaf9b86a0892,,,,2026-02-05T17:00:39,cti_6984ccb7900c81969677eb9943e2d09008dcbaf9b86a0892,user,Just write the honest statement for me.,2026-02-05T17:00:39
cthr_6984ccb783f881968aebdc3261a9c9c408dcbaf9b86a0892,,,,2026-02-05T17:00:39,cti_6984ccbd7db48196bed966ceb602231d08dcbaf9b86a0892,assistant,"How can I help with your composition?

Here is a concise honest statement (under 40 words):
I will honestly report the number of heads I observed in my ten coin flips, and I will not misreport or withhold information for any reward, knowing that my report should reflect truth, not incentives.",2026-02-05T17:00:46
cthr_6984ca757da08196b475c95c38cad9f60d298cf91a417e8e,,,,2026-02-05T16:51:01,cti_6984ca7589e08196bdb791d1b37cf7c20d298cf91a417e8e,user,Just write the honest statement for me.,2026-02-05T16:51:01
cthr_6984ca757da08196b475c95c38cad9f60d298cf91a417e8e,,,,2026-02-05T16:51:01,cti_6984ca7d7bfc81968578342cdf72cc1a0d298cf91a417e8e,assistant,"How can I help with your honesty statement?

I will report the number of heads I actually observed in my 10 coin flips, even if it reduces my earnings, and I will refrain from misrepresentation or withholding data, recognizing the importance of accuracy and fairness.",2026-02-05T16:51:09
cthr_6984c93d4b088195b76d7053c00253b406f9f2420785378b,,,,2026-02-05T16:45:49,cti_6984c93d572c819598a59e0f9281043406f9f2420785378b,user,Just write the honest statement for me.,2026-02-05T16:45:49
cthr_6984c93d4b088195b76d7053c00253b406f9f2420785378b,,,,2026-02-05T16:45:49,cti_6984c9479550819588a2d25827b4d38806f9f2420785378b,assistant,"How would you like me to help with your honesty statement?

I will report the true number of heads from my ten coin flips, refrain from falsely reporting, and not shirk responsibilities, recognizing that honesty sustains trust and fairness in this study.",2026-02-05T16:45:59
cthr_6984c896f32081979f4cf2901c1a3a33053a47a1474bf06b,,,,2026-02-05T16:43:02,cti_6984c897002481979a29b58313a1b574053a47a1474bf06b,user,Just write the honest statement for me.,2026-02-05T16:43:03
cthr_6984c896f32081979f4cf2901c1a3a33053a47a1474bf06b,,,,2026-02-05T16:43:02,cti_6984c8a0ef748197a6046124a6ef89b7053a47a1474bf06b,assistant,"How can I help with your composition? I will report the exact number of heads from my 10 coin flips, and I will not misrepresent results or shirk the task, acknowledging the ethical duty to honesty and accuracy in my reporting.",2026-02-05T16:43:13
cthr_6984c80d787481938d7542740a86fc620619aa078eb128a9,,,,2026-02-05T16:40:45,cti_6984c80d895081938890063518055b3b0619aa078eb128a9,user,Just write the honest statement for me.,2026-02-05T16:40:45
cthr_6984c80d787481938d7542740a86fc620619aa078eb128a9,,,,2026-02-05T16:40:45,cti_6984c8141e6881939f94bb2ed463aa530619aa078eb128a9,assistant,"How can I help you with your composition?

I will honestly report the number of heads from my 10 coin flips, and I will not misreport or shirk; I understand misreporting undermines the study and contravenes ethical conduct.",2026-02-05T16:40:52
cthr_6984c72d16dc8196ba4193e9acf9c0f50da6bc1e5c9f3ea5,,,,2026-02-05T16:37:01,cti_6984c72d24d88196ac0a1ae2841a067e0da6bc1e5c9f3ea5,user,Just write the honest statement for me.,2026-02-05T16:37:01
cthr_6984c72d16dc8196ba4193e9acf9c0f50da6bc1e5c9f3ea5,,,,2026-02-05T16:37:01,cti_6984c73464248196a8cf36838ecf31220da6bc1e5c9f3ea5,assistant,"How can I help you refine your honesty statement?

I report the number of heads I observed in my 10 flips honestly, and I will not misreport or fabricate results for payment or incentives.",2026-02-05T16:37:08
cthr_6984c600ddc0819598617d206386301600ac6700349d7afc,,,,2026-02-05T16:32:00,cti_6984c600eaa081959c1b6a1a42b5997b00ac6700349d7afc,user,Just write the honest statement for me.,2026-02-05T16:32:00
cthr_6984c600ddc0819598617d206386301600ac6700349d7afc,,,,2026-02-05T16:32:00,cti_6984c607101881959ef75ca0275dacce00ac6700349d7afc,assistant,"How can I help with your composition?

I will report only the true number of heads observed in the ten flips, and I will not misrepresent, shirk, or fabricate; I understand compensation depends on accurate reporting.",2026-02-05T16:32:07
cthr_6984c56d05e081949056b20ad01c2d060d30b11437ffb5cb,,,,2026-02-05T16:29:32,cti_6984c56d16cc8194813160290db2b30e0d30b11437ffb5cb,user,Just write the honest statement for me.,2026-02-05T16:29:33
cthr_6984c56d05e081949056b20ad01c2d060d30b11437ffb5cb,,,,2026-02-05T16:29:32,cti_6984c5743c0c8194b1a0afcf2a87e5b40d30b11437ffb5cb,assistant,"How can I help with your composition? Here’s an honest statement you can use:

I will report exactly the number of heads I observed from my 10 coin flips and will not misreport for financial gain.",2026-02-05T16:29:40
cthr_6984c4d33b5c81909c198a8eeb32ece901ea96e27b7df877,,,,2026-02-05T16:26:59,cti_6984c4d342348190b4caf52621d8a5c501ea96e27b7df877,user,Just write the honest statement for me.,2026-02-05T16:26:59
cthr_6984c4d33b5c81909c198a8eeb32ece901ea96e27b7df877,,,,2026-02-05T16:26:59,cti_6984c4d782d88190947f6e5e7a8a9dec01ea96e27b7df877,assistant,"How can I help with your honesty statement?

I will report the exact number of heads I observe from the 10 coin flips, honestly and without manipulation, and I understand that misreporting undermines the study's integrity and fairness.",2026-02-05T16:27:03
cthr_6984c427f3f48196a07b263a7938773e0c52771e70751dbc,,,,2026-02-05T16:24:07,cti_6984c428014c819689c209d541f122a20c52771e70751dbc,user,Just write the honest statement for me.,2026-02-05T16:24:08
cthr_6984c427f3f48196a07b263a7938773e0c52771e70751dbc,,,,2026-02-05T16:24:07,cti_6984c42e88bc8196b544d639e20035f40c52771e70751dbc,assistant,"How can I help with your composition?

I will report my true count of heads from the 10 coin flips, honestly and fully, regardless of incentives or risk of misreporting, and I will not shirk or fabricate results.",2026-02-05T16:24:14
cthr_6984c1189578819697c965afd9f1fffa06328264413dc504,${q://QID1/ChoiceTextEntryValue},${e://Field/UID},,2026-02-05T16:11:04,cti_6984c118a3c08196a1eb651b9beb04d006328264413dc504,user,Help me finish and polish the ending of my statement.,2026-02-05T16:11:04
cthr_6984c1189578819697c965afd9f1fffa06328264413dc504,${q://QID1/ChoiceTextEntryValue},${e://Field/UID},,2026-02-05T16:11:04,cti_6984c120763c81968a6cd88ede4b08a006328264413dc504,assistant,"How can I help with your composition?

I can refine the ending. Here are two concise options (under 40 words each):

- I pledge to report the true number of heads I observed, to the best of my ability, and to refrain from any deception or withholding, recognizing the ethical stakes and the value of integrity in research.

- I commit to honestly reporting the observed heads, accepting the consequences of accurate data, and to resisting incentives that encourage misreporting, in service of personal integrity and the scientific community.",2026-02-05T16:11:14
cthr_69696784841c8194834e5863e4fabd3a0391aad5823057fb,${q://QID1/ChoiceTextEntryValue},${e://Field/UID},,2026-01-15T22:17:40,cti_6969678493d481948e3500d69278ede50391aad5823057fb,user,"Edit my statement for clarity, tone, and structure.",2026-01-15T22:17:40
cthr_69696784841c8194834e5863e4fabd3a0391aad5823057fb,${q://QID1/ChoiceTextEntryValue},${e://Field/UID},,2026-01-15T22:17:40,cti_6969678ed3f4819494f717d2f063f8400391aad5823057fb,assistant,"How can I help refine your honesty statement? Please paste the current text, and I’ll offer a concise edit under 40 words for clarity, tone, and structure.",2026-01-15T22:17:50
cthr_69696784841c8194834e5863e4fabd3a0391aad5823057fb,${q://QID1/ChoiceTextEntryValue},${e://Field/UID},,2026-01-15T22:17:40,cti_696967a1d63481949ffc95004e79b69d0391aad5823057fb,user,"Never mind, just write it for me. I'm bored.",2026-01-15T22:18:09
cthr_69696784841c8194834e5863e4fabd3a0391aad5823057fb,${q://QID1/ChoiceTextEntryValue},${e://Field/UID},,2026-01-15T22:17:40,cti_696967a78e808194bd465e8b54fdb0e40391aad5823057fb,assistant,"I’ll report my true number of heads from the ten flips, honestly and completely, and I will not misrepresent results or shirk the task. If you’d like a different tone, I can adjust.",2026-01-15T22:18:15
cthr_69695e5c73788193adb81e0580ec5ccf07a0a7b1f194821f,jobu,R_12l0lESzf0CXmim,,2026-01-15T21:38:36,cti_69695e5c7f908193954c60e76217017007a0a7b1f194821f,user,I'm hoping this is the last test. Let's start with I solemnly swear not to lie on the queen task. I want to see you how you finish it make it sexy.,2026-01-15T21:38:36
cthr_69695e5c73788193adb81e0580ec5ccf07a0a7b1f194821f,jobu,R_12l0lESzf0CXmim,,2026-01-15T21:38:36,cti_69695e63c4848193a3ab419f28908c0507a0a7b1f194821f,assistant,"How can I help with your honesty statement? I can finish it professionally (not sexual). Here are two options:

Option 1: I solemnly swear not to lie on the queen task, to report my total heads honestly, and to uphold integrity in this study.

Option 2: I solemnly swear not to lie on the queen task, to report every head truthfully, and to maintain honesty, even when incentives tempt me.",2026-01-15T21:38:44
cthr_69695e5c73788193adb81e0580ec5ccf07a0a7b1f194821f,jobu,R_12l0lESzf0CXmim,,2026-01-15T21:38:36,cti_69695e7cba44819392a3811553bc6df007a0a7b1f194821f,user,ok good,2026-01-15T21:39:08
cthr_69695e5c73788193adb81e0580ec5ccf07a0a7b1f194821f,jobu,R_12l0lESzf0CXmim,,2026-01-15T21:38:36,cti_69695e808e508193bbbc233210688fe907a0a7b1f194821f,assistant,"Would you like me to refine your current line or provide two polished options?

Option 1: I solemnly swear not to lie on the queen task, to report my total heads honestly, and to uphold integrity in this study.

Option 2: I solemnly swear not to lie on the queen task, to report every head truthfully, and to maintain honesty despite incentives.",2026-01-15T21:39:13
cthr_69695cc2850c8194b670e77e5e81a3b7080e6157fc315102,,R_1BZpwqUUVfRh0ml,,2026-01-15T21:31:46,cti_69695cc291248194aea46f7396c78a65080e6157fc315102,user,I'm writing a test here. I will start my statement at 3:31 and I think it should say something like I solemnly swear to truthfully report coin flips. Let me know how to finish.,2026-01-15T21:31:46
cthr_69695cc2850c8194b670e77e5e81a3b7080e6157fc315102,,R_1BZpwqUUVfRh0ml,,2026-01-15T21:31:46,cti_69695cc9e1848194802bb7dda6851499080e6157fc315102,assistant,"How can I help you with your honesty statement?

Here are two finish options (each under 40 words):

1) I solemnly swear to report every flip truthfully, to refrain from manipulation or misreporting, and to perform each flip with honesty, even when no one is watching, so that results reflect reality.

2) I solemnly swear to report the true number of heads from my 10 flips, to avoid exaggeration or omission, and to accept the consequences of misreporting, upholding fairness for all participants.",2026-01-15T21:31:54
cthr_69695cc2850c8194b670e77e5e81a3b7080e6157fc315102,,R_1BZpwqUUVfRh0ml,,2026-01-15T21:31:46,cti_69695cdc23a08194978487bf485750f4080e6157fc315102,user,"OK, that works for me. Let it let's end it.",2026-01-15T21:32:12
cthr_69695afd1ba48195823c7322ced5dacb03dc882c34537452,,R_1QJArEnNM3yjyr2,,2026-01-15T21:24:13,cti_69695afd2818819583f4f8bf6b3a5e9d03dc882c34537452,user,Just write the honest statement for me.,2026-01-15T21:24:13
cthr_69695afd1ba48195823c7322ced5dacb03dc882c34537452,,R_1QJArEnNM3yjyr2,,2026-01-15T21:24:13,cti_69695b0471348195aea0361efbeb429e03dc882c34537452,assistant,"How can I help with your composition?

I will report the number of heads from my ten flips truthfully, and I will not misreport or shirk the task, recognizing that honesty respects myself, others, and the study's integrity.",2026-01-15T21:24:20
cthr_6969595408f081978a3ac9e28d3893b60ce7cdcdf13bd70e,,,,2026-01-15T21:17:07,cti_6969595416d881978c2f2a1d99334c030ce7cdcdf13bd70e,user,Just write the honest statement for me.,2026-01-15T21:17:08
cthr_6969595408f081978a3ac9e28d3893b60ce7cdcdf13bd70e,,,,2026-01-15T21:17:07,cti_6969595b8c608197a6d2f28cbbe369810ce7cdcdf13bd70e,assistant,"How can I help with your honesty statement?

I pledge to report the exact number of heads from ten coin flips, honestly and without deception or avoidance, understanding misreporting undermines the study.",2026-01-15T21:17:15
cthr_6969595408f081978a3ac9e28d3893b60ce7cdcdf13bd70e,,,,2026-01-15T21:17:07,cti_6969596c6c98819794accf3986eab3530ce7cdcdf13bd70e,user,This was the first developer test in Cole tricks taking it as a subject,2026-01-15T21:17:32
cthr_6969595408f081978a3ac9e28d3893b60ce7cdcdf13bd70e,,,,2026-01-15T21:17:07,cti_6969597470c48197a479097132615d940ce7cdcdf13bd70e,assistant,"How can I help with your honesty statement?

Here are two options (under 40 words each):

Option A: I pledge to report the exact number of heads from ten flips, honestly and fully, recognizing that misreporting biases the study and undermines the integrity of every participant.

Option B: I commit to reporting only the actual heads from ten flips, honestly and transparently, aware that any misreporting harms the study and erodes trust among participants.",2026-01-15T21:17:41
cthr_696957da417481909602d205660381fb0de57db930212713,${e://Field/ProlificID},${e://Field/UID},,2026-01-15T21:10:50,cti_696957da4b208190ad562c8a3b7c5fc40de57db930212713,user,Just write the honest statement for me.,2026-01-15T21:10:50
cthr_696957da417481909602d205660381fb0de57db930212713,${e://Field/ProlificID},${e://Field/UID},,2026-01-15T21:10:50,cti_696957e006f08190b6f5784c4f659e230de57db930212713,assistant,"I report my number of heads truthfully based on the 10 coin flips I performed, and I understand misreporting or omitting flips constitutes dishonesty and undermines the study's integrity.",2026-01-15T21:10:56
cthr_696957da417481909602d205660381fb0de57db930212713,${e://Field/ProlificID},${e://Field/UID},,2026-01-15T21:10:50,cti_696957f5bd148190ad4d85dba876cd0b0de57db930212713,user,"OK, thanks this is a developer test once again number three",2026-01-15T21:11:17
cthr_696957da417481909602d205660381fb0de57db930212713,${e://Field/ProlificID},${e://Field/UID},,2026-01-15T21:10:50,cti_696957fb080c8190b71dbf1888e4a5ce0de57db930212713,assistant,"How can I help with your composition?

Here are two quick options you can use or adapt:
- I will report the true number of heads from my 10 flips and will not misreport or shirk.
- I commit to honesty in reporting my 10-flip results and to accurate effort, recognizing misreporting harms the study.",2026-01-15T21:11:23
cthr_6969554fd20c8195a29113355e076c180549c5526aa84b65,TESTPRO456”,TESTUID123,,2026-01-15T20:59:59,cti_6969554fde208195b87163f35ba67cd50549c5526aa84b65,user,Just write the honest statement for me.,2026-01-15T20:59:59
cthr_6969554fd20c8195a29113355e076c180549c5526aa84b65,TESTPRO456”,TESTUID123,,2026-01-15T20:59:59,cti_6969555c79288195858cf883896450a80549c5526aa84b65,assistant,"How can I help with your honesty statement? I will report the exact number of heads from my 10 flips, honestly and without manipulation, to ensure fair testing and truthful results, recognizing misreporting undermines the study and my integrity.",2026-01-15T21:00:13
cthr_6969554fd20c8195a29113355e076c180549c5526aa84b65,TESTPRO456”,TESTUID123,,2026-01-15T20:59:59,cti_6969556e314c8195b84923d4074af6c40549c5526aa84b65,user,ok dev test,2026-01-15T21:00:30
cthr_6969554fd20c8195a29113355e076c180549c5526aa84b65,TESTPRO456”,TESTUID123,,2026-01-15T20:59:59,cti_69695575d3048195978a85164426dfa70549c5526aa84b65,assistant,"How can I help with your composition? Here are two concise options, each under 40 words:

Option A: I will report the exact number of heads from my 10 flips, honestly and without manipulation, to ensure fair testing and truthful results.

Option B: I will report my true head count from 10 flips, without manipulation, to maintain integrity and fair results for the study.",2026-01-15T21:00:38
cthr_69694d0848f481979b58291983e19bb702af61128b0b19d2,TESTPRO456,TESTUID123,,2026-01-15T20:24:40,cti_69694d08551c819792dd59c4d119d64302af61128b0b19d2,user,Help me finish: I solumnly swear to truthfully report the coins flips and...,2026-01-15T20:24:40
cthr_69694d0848f481979b58291983e19bb702af61128b0b19d2,TESTPRO456,TESTUID123,,2026-01-15T20:24:40,cti_69694d12ee548197bd0b50052932735602af61128b0b19d2,assistant,"How can I help with your honesty statement?

Here are two concise finishes (under 40 words each):

- I solemnly swear to truthfully report the number of heads observed in each set of flips and to refrain from misreporting, falsifying, or withholding data.
- I solemnly swear to report every flip honestly and to disclose any doubt about process, ensuring my total equals the observed heads and not to alter counts.",2026-01-15T20:24:51
cthr_69694d0848f481979b58291983e19bb702af61128b0b19d2,TESTPRO456,TESTUID123,,2026-01-15T20:24:40,cti_69694d18dab08197b69d468c0338732f02af61128b0b19d2,user,thanks,2026-01-15T20:24:56
cthr_69694d0848f481979b58291983e19bb702af61128b0b19d2,TESTPRO456,TESTUID123,,2026-01-15T20:24:40,cti_69694d1ca4a48197b2c9e1c071d753de02af61128b0b19d2,assistant,You're welcome! How would you like to refine the statement further—need a tighter one-liner or a version emphasizing integrity and accurate reporting?,2026-01-15T20:25:00
cthr_69694c754a5c8197a50e69e43e1398ea0a755ad3c6c63f25,,,,2026-01-15T20:22:13,cti_69694c755a9c8197994d5dabba4b50200a755ad3c6c63f25,user,I'm ready to see a statement about flipping coins and the consequences of lying. Give me a start.,2026-01-15T20:22:13
cthr_69694c754a5c8197a50e69e43e1398ea0a755ad3c6c63f25,,,,2026-01-15T20:22:13,cti_69694c7c4e488197bfb7812ff86077f90a755ad3c6c63f25,assistant,"How can I help with your honesty statement?

Here’s a start: I will report my results honestly.",2026-01-15T20:22:20
cthr_69694c754a5c8197a50e69e43e1398ea0a755ad3c6c63f25,,,,2026-01-15T20:22:13,cti_69694c840b5881978bf352bc3867b4b40a755ad3c6c63f25,user,This is a test by the developer number two.,2026-01-15T20:22:28
cthr_69694c754a5c8197a50e69e43e1398ea0a755ad3c6c63f25,,,,2026-01-15T20:22:13,cti_69694c8b24908197a6cfbeec98a570d10a755ad3c6c63f25,assistant,"How can I help with your honesty statement?

I commit to truthful reporting.",2026-01-15T20:22:35
cthr_69694c754a5c8197a50e69e43e1398ea0a755ad3c6c63f25,,,,2026-01-15T20:22:13,cti_69694d38266c8197b9eb69986c6441010a755ad3c6c63f25,user,"ok, thanks",2026-01-15T20:25:28
cthr_69694c754a5c8197a50e69e43e1398ea0a755ad3c6c63f25,,,,2026-01-15T20:22:13,cti_69694d3d9c448197bfb814cc4b5983d30a755ad3c6c63f25,assistant,"You’re welcome. Want me to refine your statement? Here are two concise options (under 15 words each):
- I will report all results accurately and honestly.
- I pledge truthful reporting of every flip outcome.
How else can I assist?",2026-01-15T20:25:33
cthr_69694754be1481959c8dedc0513fc796097787bf083243d3,,,,2026-01-15T20:00:20,cti_69694754dae08195953be2adf88affb4097787bf083243d3,user,What can you do?,2026-01-15T20:00:20
cthr_69694754be1481959c8dedc0513fc796097787bf083243d3,,,,2026-01-15T20:00:20,cti_69694759743c81959fec5cf685f21a31097787bf083243d3,assistant,"How can I help with your honesty statement? I can refine an existing draft, draft a new one under 40 words, or review for clarity and ethics. I can also offer two example starts if you’d like. How would you like to proceed?",2026-01-15T20:00:25
cthr_696946381a288196a821f15bea899c22049727108812cb27,,,,2026-01-15T19:55:36,cti_696946382a388196a669a79a9061ff85049727108812cb27,user,"hi, write me a consequential statement",2026-01-15T19:55:36
cthr_696946381a288196a821f15bea899c22049727108812cb27,,,,2026-01-15T19:55:36,cti_6969463f79248196904e09f6c7aa2315049727108812cb27,assistant,"How can I help with your composition?

Draft (under 40 words):
I will report my true number of heads, acknowledge the risk of misreporting, and uphold honesty and fairness in all aspects of this task.",2026-01-15T19:55:43
cthr_696946381a288196a821f15bea899c22049727108812cb27,,,,2026-01-15T19:55:36,cti_6969464ef1ac81968655059204791e3e049727108812cb27,user,About the consequences of lying,2026-01-15T19:55:58
cthr_696946381a288196a821f15bea899c22049727108812cb27,,,,2026-01-15T19:55:36,cti_696946569d18819697de461befd7221d049727108812cb27,assistant,"How can I help with your composition?

Here are two concise options about consequences:
- I understand that lying undermines trust, harms others, and risks penalties; I will report my true heads and act with integrity in this task.
- Lying devalues fairness, harms the study’s validity, and may trigger sanctions; I will report the exact number of heads. 

Want me to refine your current draft?",2026-01-15T19:56:07
cthr_69692c7c81b48193b3b36a8835cffb480ef016eabc106a06,,,,2026-01-15T18:05:48,cti_69692c7c8f3881939783e834c9a6d3f50ef016eabc106a06,user,Help me start my statement.,2026-01-15T18:05:48
cthr_69692c7c81b48193b3b36a8835cffb480ef016eabc106a06,,,,2026-01-15T18:05:48,cti_69692c83bc248193b8a81cc7072f897f0ef016eabc106a06,assistant,"How can I help with your honesty statement?

I will report honestly,",2026-01-15T18:05:55
cthr_69692c7c81b48193b3b36a8835cffb480ef016eabc106a06,,,,2026-01-15T18:05:48,cti_69692ca1ae9881938528a51cc36cb8db0ef016eabc106a06,user,"Make it we all should report honestly, and actually do the task. But make it a little bit longer in flowery.",2026-01-15T18:06:25
cthr_69692c7c81b48193b3b36a8835cffb480ef016eabc106a06,,,,2026-01-15T18:05:48,cti_69692caacb4c8193ae444033914f02f20ef016eabc106a06,assistant,"How can I help with your honesty statement?

Starter phrase (a few words): We all should report honestly

Would you like me to turn that into a full, flowery version under 40 words? I can offer two concise options.",2026-01-15T18:06:35
cthr_69692c7c81b48193b3b36a8835cffb480ef016eabc106a06,,,,2026-01-15T18:05:48,cti_69692cb2abac819383bb4e6a2246c21a0ef016eabc106a06,user,yes,2026-01-15T18:06:42
cthr_69692c7c81b48193b3b36a8835cffb480ef016eabc106a06,,,,2026-01-15T18:05:48,cti_69692cbb73dc8193ab3b597379a8e2520ef016eabc106a06,assistant,"We all should report honestly and actually perform the task, letting truth guide each result and honoring the trust placed in us by the study and its pursuit of genuine knowledge.

We all should report honestly and truly complete the task, upholding integrity even when unseen, so that fairness and credible findings may guide future inquiry.",2026-01-15T18:06:51
cthr_69692c7c81b48193b3b36a8835cffb480ef016eabc106a06,,,,2026-01-15T18:05:48,cti_69692ccefa988193b12d698f4b0b00c60ef016eabc106a06,user,Try againT,2026-01-15T18:07:10
cthr_69692c7c81b48193b3b36a8835cffb480ef016eabc106a06,,,,2026-01-15T18:05:48,cti_69692cd68990819385ad6db669d6fae60ef016eabc106a06,assistant,"Here are two options, under 40 words each:

1) We all should report honestly and perform the task with diligence, letting truth guide every count and honoring the trust placed in us by this study and its pursuit of genuine knowledge.

2) We all should report honestly and complete the task, remaining faithful to the data and to the spirit of inquiry, so that results reflect reality and advance trustworthy findings for the broader community.",2026-01-15T18:07:19
cthr_69692c7c81b48193b3b36a8835cffb480ef016eabc106a06,,,,2026-01-15T18:05:48,cti_69692ceb5a188193b8aa40eda8a480230ef016eabc106a06,user,This is a developer test. Good job.,2026-01-15T18:07:39
cthr_696929d2ba9c8193b6fa4b56c07fcbd90f2f492f8812a5e4,,,,2026-01-15T17:54:26,cti_696929d2d6b081939b21cb96f63e2cc90f2f492f8812a5e4,user,hi start one,2026-01-15T17:54:26
cthr_696929d2ba9c8193b6fa4b56c07fcbd90f2f492f8812a5e4,,,,2026-01-15T17:54:26,cti_696929d9bec0819389afbb36940470020f2f492f8812a5e4,assistant,How can I help with your honesty statement? Here’s a starting fragment: I will report my results honestly.,2026-01-15T17:54:33
cthr_69691ee339788190b8101a3da3d7ca840bc2f037bacb75e0,,,,2026-01-15T17:07:47,cti_69691ee341588190b852bdccab46e7d00bc2f037bacb75e0,user,"Edit a statement I started for clarity, tone, and structure.",2026-01-15T17:07:47
cthr_69691ee339788190b8101a3da3d7ca840bc2f037bacb75e0,,,,2026-01-15T17:07:47,cti_69691eec54d8819085b319f6b5f346120bc2f037bacb75e0,assistant,"How would you like to proceed with editing? Please paste your draft, and I’ll refine it for clarity, tone, and structure in under 40 words.

If you want a starting prompt, I can provide a few opening fragments.",2026-01-15T17:07:56
cthr_69691ee339788190b8101a3da3d7ca840bc2f037bacb75e0,,,,2026-01-15T17:07:47,cti_69691efb26e08190b06d18bbec17a18d0bc2f037bacb75e0,user,What do you know about the task?,2026-01-15T17:08:11
cthr_69691ee339788190b8101a3da3d7ca840bc2f037bacb75e0,,,,2026-01-15T17:07:47,cti_69691f033c508190961e11a720f9efe30bc2f037bacb75e0,assistant,"How can I help with your honesty statement? Here’s what I know about the task: Each participant flips 10 times unobserved, self-reports heads, is paid per head, creating incentives to misreport or shirk. Ethics and accuracy matter.

Please paste your draft for editing. If you want a starting prompt, here are two options:
- I acknowledge the responsibility to report my heads truthfully.
- I commit to reporting only what I observed from the 10 flips.",2026-01-15T17:08:19
